id,type,tag,box,content
"https://betalab.kb.se/prot-1943--ak--4#1-6-cblock_0-block_0",Text,1,"292,135,1007,37","6 Nr 4. Lördagen den 23 januari 1943.\n"
"https://betalab.kb.se/prot-1943--ak--4#1-6-cblock_1-block_1",Text,1,"294,222,1503,81","herr Hansson i Skediga, nr 162, om statsbidrag till sommarresor för landsbygdens\n barn;\n"
"https://betalab.kb.se/prot-1943--ak--4#1-6-cblock_1-block_2",Text,1,"293,306,1505,82","herr Lundh m. fl., nr 163, om anslag till undersökande av lapska språket och\nlapsk kultur;\n"
"https://betalab.kb.se/prot-1943--ak--4#1-6-cblock_1-block_3",Text,1,"291,392,1504,124","herrar Lundh och Larsson i Karlstad, nr 164,, om inrättande för Seth Lundell\n av en personlig assistentbefattning i mykologi vid Uppsala universitets botaniska\n museum;\n"
"https://betalab.kb.se/prot-1943--ak--4#1-6-cblock_1-block_5",Text,1,"290,603,1503,84","herr Hagård, nr 166, om placering i lönegrad av viss ifrågasatt revisorstjänst\n i socialstyrelsen;\n"
"https://betalab.kb.se/prot-1943--ak--4#1-6-cblock_1-block_4",Text,1,"290,519,1504,81","herr Lundh m. fl., nr 165, om tilläggsunderstöd åt fackskolan för huslig ekonomi\n i Uppsala;\n"
"https://betalab.kb.se/prot-1943--ak--4#1-6-cblock_1-block_6",Text,1,"289,688,1504,84","herr Lundell m. fl., nr 167, om inrättande av en särskild kavalleriavdelning\ninom arméinspektionen, m. m.;\n"
"https://betalab.kb.se/prot-1943--ak--4#1-6-cblock_1-block_7",Text,1,"290,773,1499,92","herrar Levin och Ekdahl, nr 168, i anledning av Kungl. Maj:ts framställning\n om bidrag till driften av centralanstalter för radioterapi;\n"
"https://betalab.kb.se/prot-1943--ak--4#1-6-cblock_1-block_8",Text,1,"286,857,1505,82","herr Svedman m. fl., nr 169, om restitution av vissa skattskyldiga påförda\nskatter, m. m.;\n"
"https://betalab.kb.se/prot-1943--ak--4#1-6-cblock_1-block_9",Text,1,"286,941,1504,96","herr Lindberg i Umeå, nr 170, angående uppförande vid Karolinska sjukhuset\n av en avdelning för reumatiska och andra invalidiserande sjukdomars vård;\n"
"https://betalab.kb.se/prot-1943--ak--4#1-6-cblock_1-block_12",Text,1,"283,1113,1506,81","nr 172, om anslag till uppförande av ett varmbadhus med simhall inom Bodens\n garnison;\n"
"https://betalab.kb.se/prot-1943--ak--4#1-6-cblock_1-block_10",Text,1,"331,1026,377,42","herr Lövgren m. fl.:\n"
"https://betalab.kb.se/prot-1943--ak--4#1-6-cblock_1-block_11",Text,1,"330,1070,1416,55","nr 171, om lönereglering för vissa föreståndarinnor vid nomadskolhem; och\n"
"https://betalab.kb.se/prot-1943--ak--4#1-6-cblock_1-block_14",Text,1,"329,1281,319,35","herr Henriksson:\n"
"https://betalab.kb.se/prot-1943--ak--4#1-6-cblock_1-block_13",Text,1,"283,1196,1505,88","herr Malmborg m. fl., nr 173, angående utredning om orsakerna till det försämrade\n nykterhetstillståndet, m. m.;\n"
"https://betalab.kb.se/prot-1943--ak--4#1-6-cblock_1-block_16",Text,1,"327,1366,1187,53","nr 175, om sänkning av omsättningsskatten för vissa varuslag;\n"
"https://betalab.kb.se/prot-1943--ak--4#1-6-cblock_1-block_15",Text,1,"327,1324,1460,55","nr 174, angående revision av lagstiftningen om allmän omsättningsskatt; och\n"
"https://betalab.kb.se/prot-1943--ak--4#1-6-cblock_1-block_17",Text,1,"278,1408,1508,208","herr Skoglund i Umeå m. fl., nr 176, angående viss ändring i förordningen\nSR frenilda bestämmelser angående indrivning av utskylder hos vissa skattskyldiga;\n\nj hörr Sundqvist m. fl., nr 177, angående beskattning av tidningar och tidskrifter;\n\n"
"https://betalab.kb.se/prot-1943--ak--4#1-6-cblock_1-block_18",Text,1,"279,1620,1506,123","herrar Witzell och Lindén, nr 178, angående viss begränsning av rätten till\navdrag vid inkomstbeskattningen för premier, som erläggas för pensionsförsäkring;\n\n"
"https://betalab.kb.se/prot-1943--ak--4#1-6-cblock_1-block_20",Text,1,"276,1833,1505,85","herr Fröderberg, nr 180, angående viss ändring i förordningen angående försäljning\n av pilsnerdricka;\n"
"https://betalab.kb.se/prot-1943--ak--4#1-6-cblock_1-block_19",Text,1,"277,1748,1506,89","herr Witzell, nr 179, angående åstadkommande av effektivare kontroll i beskattningsavseende\n över näringsutövare;\n"
"https://betalab.kb.se/prot-1943--ak--4#1-6-cblock_1-block_21",Text,1,"322,1917,1147,56","herr Hedqvist, nr 181, om skattefrihet för s. k. ledarhundar;\n"
"https://betalab.kb.se/prot-1943--ak--4#1-6-cblock_1-block_22",Text,1,"276,1959,1506,127","herr Severin i Stockholm, nr 182, om rätt för skattskyldig att vid taxering\ntill statlig inkomst- och förmögenhetsskatt åtnjuta avdrag för gåvor till flygvapnets\n hjälpfond;\n"
"https://betalab.kb.se/prot-1943--ak--4#1-6-cblock_1-block_23",Text,1,"276,2087,1503,95","herr Severin i Stockholm m. fl., nr 183, om den av staten understödda frivilliga\n skytterörelsens befrielse från erläggande av vissa skatter;\n"
"https://betalab.kb.se/prot-1943--ak--4#1-6-cblock_1-block_24",Text,1,"318,2172,250,34","herr Kilbom:\n"
"https://betalab.kb.se/prot-1943--ak--4#1-6-cblock_1-block_25",Text,1,"275,2215,1502,83","nr 184, om gratifikation åt vaktmästaren hos riksdagens andra kammare E.\nE. Anderssons änka; och\n"
"https://betalab.kb.se/prot-1943--ak--4#1-6-cblock_1-block_27",Text,1,"273,2384,1502,81","herr Jonsson i Eskilstuna, nr 186, nr tilläggspension åt faktoriarbetaren ÅA.\nHj. Larsson;\n"
"https://betalab.kb.se/prot-1943--ak--4#1-6-cblock_1-block_26",Text,1,"273,2300,1504,100","nr 185, om gratifikation till vaktmästaren hos riksdagens andra kammare E.\nE. Johanssons änka; |\n"
"https://betalab.kb.se/prot-1943--ak--4#1-6-cblock_1-block_28",Text,1,"317,2468,1376,58","herr Ekdahl, nr 187, om förhöjd pension åt förre konduktören N. Lovén;\n"
