;wiki_id;surname_iort;first_name;page_ref;page_ref2;iort;born
3331;Q6198588;Svensson i Grönvik; G Hjalmar; 2:239;;i Grönvik;1881-02-01
3332;Q6198615;Svensson i Grindstorp; K Isak; 4:157;;i Grindstorp;1864-06-27
3333;Q6198619;Svensson i Skyllberg; Ivan E G; 4:515;;i Skyllberg;1858-10-07
3334;Q6198628;Svensson i Greverum; Jakob M; 2:111;;i Greverum;1825-06-20
3335;Q6198648;Svensson i Göteborg; Jerker U; 4:158;;i Göteborg;1897-07-18
3336;Q6331764;Svensson i Betingetorp; Johan G; 2:239;;i Betingetorp;1864-11-06
3337;Q6198687;Svensson i Stockholm; Johannes; 1:176;;i Stockholm;1856-07-08
3338;Q6198784;Svensson i Baggetorp; Lars Johan; 2:311;;i Baggetorp;1823-03-31
3339;Q6198844;Svensson i Stora Torpa; Magnus; 4:354;;i Stora Torpa;1821-04-01
3340;Q6198871;Svensson i Kompersmåla; N J Martin; 2:240;;i Kompersmåla;1871-09-01
3341;Q6198941;Svensson i Långelanda; Nils; 4:443;;i Långelanda;1861-11-18
3342;Q6198963;Svensson i Malmberget; Nils; 5:442;;i Malmberget;1884-01-15
3343;Q6198949;Svensson i Olseröd; Nils; 3:151;;i Olseröd;1844-02-13
3344;Q6199002;Svensson i Eskilstuna; Olle F S; 1:397;;i Eskilstuna;1925-03-19
3345;Q6199009;Svensson i Saläng; Otto H; 4:276;;i Saläng;1857-10-20
3346;Q18246296;Svensson i Alingsås; S Patrik; 4:276;;i Alingsås;1895-10-12
3347;Q6199041;Svensson i Bondön; Pehr; 5:442;;i Bondön;1856-11-17
3348;Q117289037;Svensson i Eggelstad; Per; 3:276;;i Eggelstad;1881-04-22
3349;Q6199074;Svensson i Stenkyrka; Per G A; 2:346;;i Stenkyrka;1896-02-05
3350;Q6199107;Svensson i Brämhult; Peter; 4:276;;i Brämhult;1826-06-05
3351;Q6199126;Svensson i Spjutsbygd; K Rikard; 3:79;;i Spjutsbygd;1900-05-31
3352;Q4981537;Svensson i Kungsör; Rosa A M; 1:456;;i Kungsör;1903-10-25
3353;Q6199190;Svensson i Krokstorp; Sven A; 2:311;;i Krokstorp;1904-07-28
3354;Q6199259;Svensson i Ljungskile; G Waldemar; 4:158;;i Ljungskile;1897-05-26
3355;Q6199507;Svänsson i Kalmar; E Eli; 2:312;;i Kalmar;1865-02-12
3356;Q116040430;Svenungsson i Qvatroneröd; Arne A D; 4:159;;i Qvatroneröd;1914-02-03
3357;Q6199292;Svenungsson i Stockholm; David C; 1:177;;i Stockholm;1911-04-09
3358;Q110096942;Svärd i Holsbybrunn; S J Gottfrid; 2:188;;i Holsbybrunn;1880-12-25
3359;Q6199516;Svärd i Ulriksdal senare Solna; N Gunnar; 2:188; 4:159;i Ulriksdal senare Solna;1911-05-25
3360;Q6200318;von Sydow i Halmstad; Carl Fredric; 2:402;;i Halmstad;1832-08-21
3361;Q6200331;von Sydow i Stavsjöbruk; Christian F C H; 2:111;;i Stavsjöbruk;1899-06-05
3362;Q6200348;von Sydow i Hammenhög; J Fredrik; 3:152;;i Hammenhög;1826-11-03
3363;Q6200366;von Sydow i Stockholm; A Hjalmar; 1:177; 4:516;i Stockholm;1862-08-22
3364;Q6200560;Sylwan i Malmö; Eilif C; 3:276;;i Malmö;1884-05-25
3365;Q6200478;Sylvan i Rönnetorp; Hakon T; 3:276;;i Rönnetorp;1883-05-20
3366;Q6201132;Säfstrand i Hörby; Ivar A; 3:277;;i Hörby;1872-06-23
3367;Q6201203;Sälling i Brånsta; Gustaf; 1:457;;i Brånsta;1832-12-27
3368;Q6201220;Sällström i Nederkalix; Johan; 5:443;;i Nederkalix;1830-02-21
3369;Q6201330;Säve i Mariestad; J Adolf; 4:354;;i Mariestad;1800-03-29
3370;Q6201341;Säve i Karlstad; Teofron A; 4:443;;i Karlstad;
3371;Q6201372;Sävström i Bollnäs; August V; 5:175;;i Bollnäs;1879-03-25
3372;Q6201401;Sääf i Norrköping; Jöran R; 2:112;;i Norrköping;1819-04-16
3373;Q6201541;Söderberg i Stockholm; Ernst J; 1:178;;i Stockholm;1871-01-09
3374;Q6201579;Söderberg i Rotebro senare Norrviken; K Johan; 1:270;;i Rotebro senare Norrviken;1877-07-26
3375;Q6201599;Söderberg i Rosendala; P Magnus; 2:188;;i Rosendala;1835-08-05
3376;Q6201693;Söderberg i Hobborn; Samuel; 5:96;;i Hobborn;1859-01-09
3377;Q6201706;Söderberg i Västerås senare Dingtuna; Sten T R; 1:457;;i Västerås senare Dingtuna;1906-12-14
3378;Q6201799;Söderbergh i Karlshamn; S Frithiof E; 3:79;;i Karlshamn;1864-04-10
3379;Q6201809;Söderblom i Eskilstuna; L Knut; 1:397;;i Eskilstuna;1846-05-13
3380;Q6201849;Söderbom i Surte; Julius F L; 4:444;;i Surte;1864-07-13
3381;Q111660706;Söderbom i Gröndal; A Vilhelm; 4:355;;i Gröndal;1861-12-25
3382;Q6201867;Söderdahl i Visby; Karl F; 2:347;;i Visby;1882-03-30
3383;Q18246424;Söderhielm i Stockholm; K Erik W; 1:178;;i Stockholm;1871-05-07
3384;Q6201926;Söderhielm i Långvind; Wilhelm A; 5:175;;i Långvind;1831-12-26
3385;Q6201981;Söderkvist i Alnö; J L Vemer; 5:261;;i Alnö;1885-06-15
3386;Q6202203;Söderquist i Solna; Martin; 1:270;;i Solna;1893-06-25
3387;Q6202293;Söderström i Stockholm; Carl C; 1:178;;i Stockholm;1824-10-03
3388;Q6202348;Söderström i Norrköping; Kurt I W; 2:112;;i Norrköping;1914-07-11
3389;Q6202601;Sörenson i Älvsjö; Joel; 1:179;;i Älvsjö;1915-10-27
3390;Q6202605;Sörenson i Göteborg; Lars-Ingvar; 4:160;;i Göteborg;1920-10-11
3391;Q6202617;Sörensson i Frillestad; Per; 3:277;;i Frillestad;1841-05-07
3392;Q6202629;Sörlin i Åsele; Thore; 5:378;;i Åsele;1906-10-28
3393;Q6203631;Tamm i Fogelstad; C August; 1:398;;i Fogelstad;1840-06-08
3394;Q4981979;Tamm i Fogelstad; Elisabeth; 1:398;;i Fogelstad;1880-06-30
3395;Q6203642;Tamm i Österby senare Stockholm; C Gustaf A; 1:332; 5:176;i Österby senare Stockholm;1838-08-10
3396;Q6203654;Tamm i Fagersta senare Ålsten; C Gustaf L H:son; 1:457;;i Fagersta senare Ålsten;1876-09-12
3397;Q6203708;Tamm i Söderfors; P Gustaf; 1:333;;i Söderfors;1842-12-24
3398;Q6203659;Tamm i Malstanäs; Gösta; 1:398;;i Malstanäs;1866-04-15
3399;Q6203671;Tamm i Fånö; Hugo P P; 1:333; 5:313;i Fånö;1840-06-28
3400;Q6204633;Taube i Stockholm; Carl O; 5:443;;i Stockholm;1843-11-22
3401;Q6205893;Tengdahl i Stockholm senare Äppelviken; Knut A; 1:179; 4:444;i Stockholm senare Äppelviken;1867-01-09
3402;Q6205904;Tenger i Västervik; Carl F R; 2:312;;i Västervik;
3403;Q6205950;Tengström i Göteborg; Carl F Gustav; 4:160;;i Göteborg;1886-01-26
3404;Q115869391;Tengvall i Stilleryd; Axel O; 3:79;;i Stilleryd;1857-05-07
3405;Q6206359;Tersmeden i Ramnäs; Adolf; 1:458;;i Ramnäs;1836-04-17
3406;Q6206436;Tersmeden i Ramnäs; Wilhelm F; 1:458;;i Ramnäs;1802-07-31
3407;Q6206558;Testrup i Kristianstad; Erik M H G:son; 1:180;;i Kristianstad;1878-09-14
3408;Q104836509;Tham i Stäholm; Henric S; 1:459;;i Stäholm;1827-07-11
3409;Q6206825;Tham i Susegården; F A Sebastian; 2:403;;i Susegården;1847-04-10
3410;Q2575378;Tham i Huskvarna; G Wilhelm S; 2:189;;i Huskvarna;1839-09-05
3411;Q6206835;Tham i Söderhamn senare Stockholm; Volrath H S; 5:176;;i Söderhamn senare Stockholm;1867-05-28
3412;Q6206830;Tham i Stockholm; Vollrath H S; 4:516;;i Stockholm;1837-10-27
3413;Q6206899;Thapper i Finspång; G Fridolf; 2:112;;i Finspång;1899-07-08
3414;Q6206951;Thavenius i Ulricehamn; Gottfried; 4:277;;i Ulricehamn;1846-10-13
3415;Q6207127;Thelin i Växjö; Arvid; 2:240;;i Växjö;1876-03-31
3416;Q52958;Themptander i Stockholm; O Robert; 1:180; 3:152;i Stockholm;1844-02-14
3417;Q6207468;Thermænius i Hallsberg; C Edvard; 4:517;;i Hallsberg;1842-01-09
3418;Q6207546;Thestrup i Landskrona; J Gustaf; 3:278;;i Landskrona;1843-06-12
3419;Q6208470;Thomasson i Lund; Eskilander; 3:278;;i Lund;1829-06-01
3420;Q6208845;Thomson i Lund senare Stockholm; Arthur N; 3:278;;i Lund senare Stockholm;1891-11-06
3421;Q6208962;Thor i Nedansjö; C Gustaf; 5:261;;i Nedansjö;1860-11-09
3422;Q4802448;Thorberg i Stockholm; J Arvid J; 1:181;;i Stockholm;1877-04-13
3423;Q6208993;Thorburn i Uddevalla; Robert M; 4:160;;i Uddevalla;
3424;Q6208999;Thorburn i Uddevalla; William F; 4:161;;i Uddevalla;1820-11-27
3425;Q6209055;Thore i Göteborg; Alexander; 4:161;;i Göteborg;1866-12-12
3426;Q6209073;Thorell i Stolp-Ekeby; Edvard E; 1:271;;i Stolp-Ekeby;1881-03-17
3427;Q104889673;Thorell i Hökerum; Olof; 4:277;;i Hökerum;1827-03-22
3428;Q6209126;Thorén i Växjö; Carl A; 2:241;;i Växjö;1874-02-10
3429;Q116014475;Thorsell i Getingeberg; J A Torsten; 4:517;;i Getingeberg;1867-09-18
3430;Q6209474;Thorsson i Ystad; Fredrik W; 3:279;;i Ystad;1865-05-30
3431;Q4982683;Thorsson i Stockholm; Inga M; 1:181;;i Stockholm;1915-07-03
3432;Q6209652;Thulin i Stocksund; J Einar O J; 2:113;;i Stocksund;1883-02-27
3433;Q6209752;Thun i Enköping; K Edvin; 1:334;;i Enköping;1898-02-01
3434;Q6209757;Thun i Åkersberga; Fritiof V; 1:271;;i Åkersberga;1887-03-15
3435;Q16084072;Thunborg i Skärholmen; Carsten W; 1:182;;i Skärholmen;1918-06-02
3436;Q4982739;Thunvall i Ramsjö; Gunbjörg M; 5:177;;i Ramsjö;1912-08-26
3437;Q6333858;Thylander i Malmö senare Stockholm; Anders; 3:280;;i Malmö senare Stockholm;1845-02-24
3438;Q6210134;Thylén i Göteborg; Bengt-Olof; 4:162;;i Göteborg;1927-02-15
3439;Q6210181;Thyrén i Lund; Johan C W; 1:334; 3:280;i Lund;1861-04-06
3440;Q4982770;Thüring i Göteborg; Nelly M; 4:162;;i Göteborg;1875-06-21
3441;Q52956;Thyselius i Stockholm; Carl Johan; 2:241;;i Stockholm;1811-06-08
3442;Q116146163;Thörnberg i Ronneby; R Wiktor; 3:80;;i Ronneby;
3443;Q6211046;Tillberg i Nygård; Knut H R; 2:312;;i Nygård;1860-03-04
3444;Q6211603;Tisell i Örebro; C Gustaf; 4:517;;i Örebro;1869-07-18
3445;Q6211635;Tistad i Kungälv; Eskil G D; 4:162;;i Kungälv;1911-07-07
3446;Q6211896;Tjernlund i Västanbäck; Per; 5:261;;i Västanbäck;1822-03-26
3447;Q6212098;Tjällgren i Tjäll; O Leonard; 5:261;;i Tjäll;1878-09-28
3448;Q6212168;Tobé i Uppsala; Erik I; 1:335;;i Uppsala;1907-08-09
3449;Q6212615;Toll i Hedemora; Carl F; 5:96;;i Hedemora;1820-08-29
3450;Q24018260;Toll i Helsingborg; J L Osvald; 3:280;;i Helsingborg;1826-01-29
3451;Q96210772;Tonning i Hammarlöv; Olof; 3:281;;i Hammarlöv;1861-07-03
3452;Q4983117;Torbrink i Kalmar; Tekla J L; 2:313;;i Kalmar;1901-08-23
3453;Q6213407;Torelius i Stockholm; P Gustaf; 4:277;;i Stockholm;1847-02-26
3454;Q6213484;Torgén i Högfors; G Niclas; 5:314;;i Högfors;1871-02-19
3455;Q6213695;Tornegård; Oscar S; 2:313;;I Tornegård;1889-05-24
3456;Q6213719;Tornérhjelm i Vrams Gunnarstorp; Gustaf D R; 3:281;;i Vrams Gunnarstorp;1854-07-07
3457;Q6213725;Tornérhjelm i Vrams Gunnarstorp o Helsingborg; Rudolf V; 3:281;;i Vrams Gunnarstorp o Helsingborg;1814-02-19
3458;Q6213805;Torpadie i Kalmar; A Ludvig F; 2:313;;i Kalmar;1827-12-16
3459;Q6214643;af Trampe i Mjölkeröd; J D Carl W; 4:163;;i Mjölkeröd;1841-09-02
3460;Q6214692;Trana i Göteborg; Erik A; 4:163;;i Göteborg;1847-04-22
3461;Q6214703;Trana i Valö; Folke K E; 1:271;;i Valö;1909-01-15
3462;Q6214748;Tranchell i Landskrona; Justus F; 3:282;;i Landskrona;1818-04-28
3463;Q6214857;Trapp i Helsingborg; C Oscar F; 3:282;;i Helsingborg;1847-07-05
3464;Q6214979;Treffenberg i Västerås senare Härnösand, Falun o Stockholm; N Curry E; 1:459; 5:262;i Västerås senare Härnösand, Falun o Stockholm;1825-03-01
3465;Q6215406;Troedsson i Bjärnum; Troed; 3:153;;i Bjärnum;1858-09-16
3466;Q6215514;von Troil i Malmö; Samuel G; 3:282;;i Malmö;1804-05-05
3467;Q6215529;Troilius i Stockholm; Carl Oscar; 4:518;;i Stockholm;1813-01-26
3468;Q6215604;Trolle i Fulltofta; Carl A; 3:283;;i Fulltofta;1862-06-29
3469;Q6215599;Trolle i Klågerup; Carl A; 3:283;;i Klågerup;1810-07-17
3470;Q6215643;Trolle i Trollenäs; Nils A A; 3:284;;i Trollenäs;1859-03-30
3471;Q48704901;af Trolle i Karlskrona; Georg; 3:80;;i Karlskrona;
3472;Q6215663;Trolle-Bonde i Trolleholm; Carl J; 3:198;;i Trolleholm;1843-06-16
3473;Q6215672;Trolle-Wachtmeister i Trolle-Ljungby; Axel K; 3:154;;i Trolle-Ljungby;1812-03-13
3474;Q6215894;Truedsson i Haganäs; Per; 3:153;;i Haganäs;1832-10-11
3475;Q6215932;Trulsson i Starrarp; Mårten; 3:284;;i Starrarp;1828-12-07
3476;Q6216004;Trybom i Skara; Anders Peter; 4:355;;i Skara;1827-03-21
3477;Q53633;Trygger i Uppsala senare Stockholm; Ernst; 1:182; 5:97;i Uppsala senare Stockholm;1857-10-27
3478;Q6216064;Träff i Mjölby; J Axel; 2:113;;i Mjölby;1875-09-21
3479;Q6216079;Trägårdh i Stockholm; Henning; 4:518;;i Stockholm;1849-05-04
3480;Q6216096;Trägårdh i Ystad; Sven; 3:284;;i Ystad;
3481;Q6216492;Tufwesson i Lur; Tufwe; 3:153;;i Lur;
3482;Q105066959;Tundal i Robertsfors; G Oscar; 5:378;;i Robertsfors;1825-01-01
3483;Q6216923;Turesson i Mora; Bo; 5:97;;i Mora;1914-06-04
3484;Q6217636;Tynell i Trelleborg; Janne P:son; 3:285;;i Trelleborg;1875-07-01
3485;Q6217733;Tysk i Mora; Mats; 5:98;;i Mora;1841-12-13
3486;Q6217739;Tysk i Färnäs; Per; 5:98;;i Färnäs;1874-09-30
3487;Q117289118;Tågmark i Molkom; Sven G; 4:445;;i Molkom;1923-04-27
3488;Q6217831;Täcklind i Alingsås; Magnus J; 4:278;;i Alingsås;1860-08-24
3489;Q111133690;Törnblom i Finspång; G Emil; 2:114;;i Finspång;1878-11-29
3490;Q6218073;Törnebladh i Kalmar senare Stockholm; H Ragnar; 1:183; 2:314;i Kalmar senare Stockholm;1833-02-01
3491;Q6218168;Törner i Växjö; Axel G G; 2:242;;i Växjö;1837-07-18
3492;Q6218207;Törnfelt i Gryt; Anders; 2:114;;i Gryt;1803-08-12
3493;Q6218236;Törngren i Göteborg; August S; 4:163;;i Göteborg;1844-12-29
3494;Q6218297;Törnkvist i Göteborg senare Karlskrona; Algot Å; 3:80; 4:164;i Göteborg senare Karlskrona;1879-07-19
3495;Q6218303;Törnkvist i Bjuv; N ils K ; 3:285;;i Bjuv;1868-04-07
3496;Q6218380;Törnqvist i Fjärås senare Uddevalla; Peter; 2:403;;i Fjärås senare Uddevalla;1852-04-16
3497;Q6218627;Uddenberg i Karlskoga; Edvard J:son; 4:518;;i Karlskoga;1870-10-03
3498;Q20786765;Uddenberg i Varberg; Erik A E; 2:404;;i Varberg;1880-03-11
3499;Q6218798;Uggla i Svaneholm; Carl G; 4:445;;i Svaneholm;1808-07-14
3500;Q6218813;Uggla i Stockholm; Gustaf F O; 4:445;;i Stockholm;1846-01-22
3501;Q6218850;af Ugglas i Linköping senare Stockholm; C Gustaf; 1:183; 2:114;i Linköping senare Stockholm;1820-09-14
3502;Q6218856;af Ugglas i Forsmark; C Ludvig F; 1:272;;i Forsmark;1814-08-11
3503;Q6218905;Uhlén i Malmö; Axel; 3:285;;i Malmö;
3504;Q6218962;Uhr i Mörby senare Svenstorp; Anders W; 4:519;;i Mörby senare Svenstorp;1806-02-19
3505;Q6219205;Ulfsparre af Broxvik i Nygård; Gustaf J T; 2:314;;i Nygård;1819-04-13
3506;Q105072927;Ullman i Foss; M Wilfrid; 4:164;;i Foss;1854-05-21
3507;Q53733;Ullsten i Stockholm; S K Ola; 1:184;;i Stockholm;1931-06-23
3508;Q298317;Undén i Stockholm; B Östen; 4:446;;i Stockholm;1886-08-25
3509;Q6219889;Unger i Henriksholm; Adolf F; 4:278;;i Henriksholm;1838-04-30
3510;Q6219947;Unger i Nor; Jonas B; 4:447;;i Nor;1834-02-05
3511;Q6219963;Unger i Nora; E Magnus; 4:519;;i Nora;1832-11-26
3512;Q6220222;Uppström i Härnösand; Carl-David T; 5:263;;i Härnösand;1846-08-05
3513;Q6220738;Utbult i Öckerö; K Birger; 4:165;;i Öckerö;1884-10-06
3514;Q6227918;Wachtmeister af Johannishus i Vanås; Axel F; 3:153;;i Vanås;1827-11-05
3515;Q6228020;Wachtmeister af Johannishus i Wambåsa; Axel H E A:son; 3:81;;i Wambåsa;1913-12-25
3516;Q6227924;Wachtmeister af Johannishus i Karlskrona; Axel H:son; 3:81;;i Karlskrona;1855-09-19
3517;Q6215672;Wachtmeister af Johannishus i Trolle-Ljungby; Axel K; 3:154;;i Trolle-Ljungby;1812-03-13
3518;Q3916765;Wachtmeister af Johannishus i Tistad; A Fredrik C:son; 1:400;;i Tistad;1855-02-10
3519;Q6227966;Wachtmeister af Johannishus i Kristineholm; C Fredrik; 1:399;;i Kristineholm;1830-06-16
3520;Q6228008;Wachtmeister af Johannishus i Johannishus; Hans; 3:82;;i Johannishus;1828-02-23
3521;Q6228037;Wachtmeister af Johannishus i Stockholm; Hans H:son; 3:82;;i Stockholm;1851-04-22
3522;Q6228020;Wachtmeister af Johannishus i Wambåsa senare Johannishus; Hans W; 3:83;;i Wambåsa senare Johannishus;1913-12-25
3523;Q6228042;Wachtmeister af Johannishus i Strömsbergs bruk; E Henning; 1:335;;i Strömsbergs bruk;1869-07-16
3524;Q6228048;Wachtmeister af Johannishus i Johannishus senare Västeråkra; Hugo H:son; 3:83;;i Johannishus senare Västeråkra;1867-04-24
3525;Q6228276;Waern i Göteborg senare Stockholm o Steneby; Carl F; 4:165;;i Göteborg senare Stockholm o Steneby;1819-01-15
3526;Q6228302;Waern i Gävle; Lennart M; 5:177;;i Gävle;1812-10-09
3527;Q6228311;Waern i Billingsfors; A Wilhelm; 4:278;;i Billingsfors;1839-02-21
3528;Q6228340;Wagenius i Ström; Olof N; 5:314;;i Ström;1826-08-08
3529;Q6228533;Wagnsson i Oskarshamn senare Kalmar; Ruben; 2:315;;i Oskarshamn senare Kalmar;1891-09-08
3530;Q6228578;Wahl i Stockholm; Gustaf A; 1:184;;i Stockholm;1878
3531;Q117289149;Wahlberg i Ängelsberg; Nils; 1:459;;i Ängelsberg;1878-11-20
3532;Q6228885;Wahlgren i Stora Dicka; Johan; 5:98;;i Stora Dicka;
3533;Q6228879;Wahlgren i Frändesta; Johan A S; 1:400;;i Frändesta;1843-10-20
3534;Q6336122;Vahlin i Falun; O Valdemar; 5:99;;i Falun;1838-12-18
3535;Q6228959;Wahlmark i Uppsala; C Primus; 1:336;;i Uppsala;1883-06-09
3536;Q6221082;Vahlquist i Skänninge; Conrad F; 2:115; 4:519;i Skänninge;1856-01-25
3537;Q6221089;Vahlstedt i Sävare senare Hovby; Carl Otto; 4:355;;i Sävare senare Hovby;1874-04-10
3538;Q6229126;Wahlund i Stockholm senare Uppsala; Sten G W; 1:336;4:355;i Stockholm senare Uppsala;1901
3539;Q23989278;Wahren i Norrköping; Carl J; 2:115;;i Norrköping;1866-11-30
3540;Q117289318;Wahrendorff i Höjens gård; J Harry A; 4:447;;i Höjens gård;1903-04-21
3541;Q6229360;Walberg i Alingsås; S Peter; 4:279;;i Alingsås;
3542;Q6229469;Waldem i Ölvingstorp; Sten R V; 2:315Q5939069;;i Ölvingstorp;1877-08-07
3543;Q6229516;Waldén i Landskrona; Ola H:son; 3:286; 4:166;i Landskrona;1869-02-23
3544;Q6229559;Waldenström i Visby; Alfred; 2:347;;i Visby;1843-09-14
3545;Q6229600;Waldenström i Gävle senare Stockholm; Paul P; 5:178;;i Gävle senare Stockholm;1838-07-20
3546;Q6229764;Walin i Oskarshamn; Gustaf A; 2:316;;i Oskarshamn;1845-09-04
3547;Q6230047;Wall i Rottneros; G Adolf; 4:447;;i Rottneros;1821-06-23
3548;Q6230338;Wallberg i Halmstad; Isak A; 2:404;3:154,4:279;i Halmstad;1825-09-03
3549;Q6230349;Wallberg i Heagård; C Wilhelm; 2:404;;i Heagård;1827-07-14
3550;Q6230364;Wallbom i Fredriksberg; Carl F; 1:460;;i Fredriksberg;1849-05-05
3551;Q6230402;Walldén i Stockholm; J Wilhelm E; 1:185;;i Stockholm;1836-09-17
3552;Q6230443;Wallén i Nyebro; A M Gullick; 2:405;;i Nyebro;
3553;Q6230500;Wallén i Sånga-Säby; Otto A; 1:272;;i Sånga-Säby;1885-11-27
3554;Q6230552;Wallenberg i Stockholm; Gustaf O; 1:185;;i Stockholm;1863-01-06
3555;Q156797;Wallenberg i Stockholm; Knut A; 1:186;;i Stockholm;1853-05-19
3556;Q522153;Wallenberg i Stockholm; A Oscar; 1:186;;i Stockholm;1816-11-19
3557;Q6230672;Wallenius i Svaneberg; Anders T; 4:356;;i Svaneberg;1833-10-13
3558;Q6230782;Wallentheim i Nacka; Adolfv; 1:273;;i Nacka;1898-10-14
3559;Q4990136;Wallentheim i Nacka senare Tyresö o Stockholm; Annie E E; 1:273;;i Nacka senare Tyresö o Stockholm;1902-04-02
3560;Q6230797;Wallentin i Smögen; Carl H O; 4:166;;i Smögen;1856-01-28
3561;Q117289330;Waller i Stockholm; Per; 4:166;;i Stockholm;1888-12-17
3562;Q6230894;Wallerius i Hjärtum; A T Adolf; 4:167;;i Hjärtum;1874-04-12
3563;Q4951427;Wallerius i Göteborg; A Stina M; 4:167;;i Göteborg;1912-07-29
3564;Q6230970;Walles i Sundsvall; Janne G; 5:263;;i Sundsvall;1871-11-20
3565;Q4990153;Wallin i Skutskär; Eivor L; 1:337;;i Skutskär;1904-10-16
3566;Q10540434;Wallin i Midsommarkransen; Johan A; 1:274;;i Midsommarkransen;1873-08-13
3567;Q6231275;Wallin i Sätra bruk; J E Wilhelm; 4:357;;i Sätra bruk;1825-03-06
3568;Q6231327;Wallis i Stockholm; Curt; 1:187;;i Stockholm;1845-03-09
3569;Q6231399;Wallmark i Södertälje; Gunnar S; 1:274;;i Södertälje;1917-05-22
3570;Q6231420;Wallmark i Smedsbyn; Nils; 5:444;;i Smedsbyn;1835-11-24
3571;Q6231427;Wallmark i Selånger; Nils Petter; 5:263;;i Selånger;1830-07-30
3572;Q6338311;Walter i Mörsil; Olof; 5:314;;i Mörsil;1851-08-02
3573;Q6232151;Wangson i Göteborg; Otto R; 4:168;;i Göteborg;1893-05-09
3574;Q6232158;Wanhainen i Erkheikki; Y Lennart; 5:444;;i Erkheikki;1914-03-23
3575;Q6232255;Warberg i Karlstad; P Ivan; 4:448;;i Karlstad;1816-06-01
3576;Q4992875;Warburg i Stockholm; Karl J; 1:187;;i Stockholm;1852-11-23
3577;Q6232377;Ward i Norrköping; Karl S V; 2:116;;i Norrköping;1888-01-29
3578;Q6222931;Vasseur i Nora gård; Emil A; 1:275;;i Nora gård;1859-06-07
3579;Q6233433;Wavrinsky i Stockholm senare Stocksund o åter Stockholm; Edvard O V; 1:188;;i Stockholm senare Stocksund o åter Stockholm;1848-04-12
3580;Q6233448;Wawrinsky i Saltsjöbaden; Richard A; 1:275;;i Saltsjöbaden;1852-01-15
3581;Q6233956;Weckman i Kila; J Adolf; 1:400;;i Kila;1840-01-21
3582;Q6233985;Wedberg i Eskilstuna senare Stockholm; Jacob W; 1:401;;i Eskilstuna senare Stockholm;1827-10-17
3583;Q6234042;Wedén i Eskilstuna; Sven M; 1:401;;i Eskilstuna;1913-07-23
3584;Q6234071;Wedin i Borgenhill; Aron Julius; 5:315;;i Borgenhill;1876-07-01
3585;Q1360952;von Vegesack i Visby; Ernst M P; 2:348;;i Visby;1820-06-18
3586;Q6234316;Wehtje i Malmö; Ernst J; 3:286;;i Malmö;1891-07-17
3587;Q19977230;Weibull i Landskrona; H W Gunnar; 3:287;;i Landskrona;1919-01-14
3588;Q111356417;Weibull i Weibullsholm; Harry W A; 3:287;;i Weibullsholm;1875-12-13
3589;Q6338909;Weijne i Borås senare Stockholm; J Josef E; 2:242; 4:279;i Borås senare Stockholm;1893-05-20
3590;Q6338918;Weiland i Nässjö; K Hjalmar T; 2:189;;i Nässjö;1887-07-22
3591;Q6234611;Weinberg i Stora Levene; August F; 4:357;;i Stora Levene;1848-11-06
3592;Q6223367;Velander i Sundsvall; C Gustaf; 5:264;;i Sundsvall;1884-06-01
3593;Q6235028;Welander i Östersund; Per O; 5:315;;i Östersund;1868-05-10
3594;Q27996966;Welin i Herrljunga; K Sanfrid V; 4:280;;i Herrljunga;
3595;Q6235195;Wellander i Nyköping; Carl E; 1:401;;i Nyköping;1852-02-03
3596;Q4895524;Wellin i Stockholm; Bertha; 1:188;;i Stockholm;1870-09-11
3597;Q6235646;Wendt i Borås; J Alfred; 4:280;;i Borås;1830-06-26
3598;Q6235736;Wener i Svartsjö; C A Julius; 1:276;;i Svartsjö;1821-12-05
3599;Q6235750;Wengberg i Ystad; P August; 3:287;;i Ystad;1822-01-08
3600;Q110964594;Wennberg i Jönköping; Carl A; 2:190;;i Jönköping;1837-07-30
3601;Q1388588;Wennerberg i Växjö; Gunnar; 2:242;;i Växjö;1817-10-02
3602;Q6235935;Wennerfors i Sundbyberg senare Sollentuna; Alf A:son; 1:276;;i Sundbyberg senare Sollentuna;1928-10-05
3603;Q6223681;Vennersten i Borås senare Stockholm; Axel F; 4:281;;i Borås senare Stockholm;1863-01-20
3604;Q4570723;Vennerström i Sollefteå senare Ålsten; Ivar T; 5:264;;i Sollefteå senare Ålsten;1881-11-09
3605;Q6236050;Wennérus i Lidköping; Carl A J; 4:357;;i Lidköping;1821-04-01
3606;Q117289337;Wennqvist i Göteborg; Thore G B; 4:168;;i Göteborg;1881-11-09
3607;Q6236316;Werbro i Halmstad; Wiking E; 2:405;;i Halmstad;1913-06-08
3608;Q6236518;Werner i Hultsfred; Alfred; 2:316;;i Hultsfred;1885-01-21
3609;Q105115301;Werner i Stockholm; C P B Feodor; 1:189;;i Stockholm;1836-02-29
3610;Q369024;Werner i Tyresö; Lars H; 1:189;;i Tyresö;1935-07-25
3611;Q6236659;Werner i Kvarnby; N Mårten S; 3:288;;i Kvarnby;1918-09-05
3612;Q6236669;Werner i Höjen; Oscar E; 4:448;;i Höjen;1889-02-02
3613;Q4984496;Vessman i Stockholm; Signe A M; 1:189;;i Stockholm;1879-06-20
3614;Q6237330;Westberg i Hofors; H Olle; 5:178;;i Hofors;1926-09-04
3615;Q6237325;Westberg i Ljusdal; Olle R; 5:179;;i Ljusdal;1911-10-03
3616;Q6237369;Westblad i Husby; Lars Erik; 1:338 A:son; 3:83;i Husby;
3617;Q6237414;Wester i Håkanbol; J Fredrik; 4:448;;i Håkanbol;1845-08-13
3618;Q6237468;Wester i Ängelholm; Wilhelm R; 2:405; 3:155;i Ängelholm;1830-04-26
3619;Q6237552;Westerberg i Göteborg; Johan August; 4:168;;i Göteborg;1836-10-28
3620;Q6237483;Westerberg i Falköping; A Peter; 4:358;;i Falköping;
3621;Q6237662;Westerdahl i Kusta; Rikard H L; 1:460;;i Kusta;1876-06-03
3622;Q6237674;Westerdal i Strömsberg; August W; 4:281;;i Strömsberg;1821-01-06
3623;Q6237953;Westerström i Riksten; Karl K; 1:276;;i Riksten;1881-05-21
3624;Q6238086;Westin i Hagsta; Erik; 5:179;;i Hagsta;1845-12-13
3625;Q111371044;Westin i Tunabäck; Per F; 5:265;;i Tunabäck;1878-05-17
3626;Q6238249;Westlund i Kvarsätt; Isak O; 5:265;;i Kvarsätt;1867-04-21
3627;Q6238287;Westman i Växjö; Adolph P; 2:243;;i Växjö;1809-07-21
3628;Q6238310;Westman i Halmstad; Axel; 2:406;;i Halmstad;1861-03-12
3629;Q6238370; Westman i Broby; Karl Allan; 2:116;;i Broby;1883-03-05
3630;Q4353489;Westman i Uppsala senare Stockholm; Karl Gustaf; 2:117;;i Uppsala senare Stockholm;1876-08-18
3631;Q104923362;Westman i Rossvik; Per; 5:265;;i Rossvik;1841-11-21
3632;Q19977241;Westrin i Kalmar; Adolf; 2:316;;i Kalmar;1847-01-12
3633;Q6238552;Westrup i Lund; J Wilhelm M; 3:288;;i Lund;1862-05-13
3634;Q6238601;Wetter i Göteborg; S Erik P:son; 4:169;;i Göteborg;1889-04-04
3635;Q4990401;Wetterström i Linköping; Karin H; 2:118;;i Linköping;1908-03-27
3636;Q6239641;Wiberg i Malmö; J Åke T; 3:288;;i Malmö;1902-03-30
3637;Q6239811;Wickman i Stockholm; Carl Gustaf T; 5:179;;i Stockholm;1856-01-03
3638;Q3376192;Wickman i Solna; H Krister; 2:243;;i Solna;1924-04-13
3639;Q6239905;Wickström i Östersund; V Hugo; 5:315;;i Östersund;1856-05-29
3640;Q6240013;Widell i Marstrand; Gustaf E; 4:169;;i Marstrand;1815-04-02
3641;Q6240025;Widell i Stockholm; J Ludvig; 4:170;;i Stockholm;1870-10-21
3642;Q6240050;Widén i Norum; L Arthur; 4:449;;i Norum;1905-02-03
3643;Q6240063;Widén i Nyköping senare Östersund; Johan; 1:402; 5:316;i Nyköping senare Östersund;1856-02-16
3644;Q6240068;Widén i Härnösand; Jonas; 5:266;;i Härnösand;1824-11-15
3645;Q6240086;Widén i Östersund; A Martin; 5:316;;i Östersund;1902-08-21
3646;Q6240290;Widlund i Jönköping; C A Thure; 2:190;;i Jönköping;1871-01-30
3647;Q6240343;Widmark i Luleå senare Karlstad; H Adolf; 5:444;;i Luleå senare Karlstad;1833-09-05
3648;Q6240370;Widmark i Ljusdal senare Falun; C Olof; 5:180;;i Ljusdal senare Falun;1831-11-16
3649;Q6240391;Widner i Kolsva; Gustafv; 1:460;;i Kolsva;1893-10-14
3650;Q6240442;Widström i Stockholm; C Ulric; 1:190;;i Stockholm;1833-06-19
3651;Q6240664;Wieselgren i Göteborg senare Stockholm; P Sigfrid; 4:170;;i Göteborg senare Stockholm;1843-11-26
3652;Q105037888;Wieslander i Ingelstad; Sven; 2:243;;i Ingelstad;1828-10-22
3653;Q6240742;Wigarth i Byarum; Axel W; 2:190;;i Byarum;1819
3654;Q6224947;Vigelsbo i Mamre; Sven J; 1:422;;i Mamre;1898-10-30
3655;Q1145662;Wigforss i Göteborg senare Stockholm; Ernst J; 3:84; 4:171;i Göteborg senare Stockholm;1881-01-24
3656;Q6240962;Wijk i Göteborg; Erik; 4:171;;i Göteborg;1836-03-01
3657;Q6240968;Wijk i Göteborg; Hjalmar; 4:172;;i Göteborg;1877-03-10
