wiki_id;surname_iort;first_name;born;references
Q6241475;Wikstén i Öjebyn; Johan Eric;1848-07-28; 5:446
Q6241544;Wikström i Trossnäs; B J Carl;1821-03-05; 4:450
Q94645211;Wikström i Karlskrona; Helmer L;1898; 3:84
Q6241615;Wikström i Torp; Johan Magnus;1818-05-05; 4:174
Q6241664;Wikström i Sundsvall; Olof;1826-11-15; 5:267
Q6241671;Wikström i Söderhamn; P O Oswald;1845-06-07; 5:181
Q6243024;Williamson i Järlövsgård; T Archibald;1838-02-25; 2:406
Q6225637;Winborg i Åna; R Abel;1835-09-17; 4:359
Q6243918;Winborg i Stockholm; J Theodor;1832-02-04; 1:192
Q6243983;Windahl i Falun; Gustaf J;1860-12-28; 5:99
Q6244387;Winkrans i Göteborg; Carl Fredrik;1826-07-06; 4:174
Q6245172;Wistelius i Örebro; P Leonard;1815-11-02; 4:521
Q6245347;Witt i Karlskrona; Gustaf Carl;1814-04-05; 3:85
Q6245359;Witt i Helsingborg; Holjer A;1818-02-17; 3:289
Q6245444;Witthoff i Araskoga; Nils A;1821-06-24; 3:290
Q6227277;Vougt i Nyköping; J Henric;1820-11-24; 1:402
Q6246999;Wrangel von Brehmer i Toppeladugård; G Helmuth;1843-10-03; 3:291
Q6247005;Wrangel von Brehmer i Hyby; J Wolmer;1836-06-15; 3:292
Q6247175;Wrede af Elimä i Kristianstad; F Casimir;1818-07-30; 3:156
Q6227559;Vult von Steyern i Sviestad; Henrik W;1806-05-06; 2:118
Q6248361;Wåhlin i Arboga; Carl I;1841-10-11; 1:461
Q6248172;Wändahl i Ålsta; G Adolf;1845-08-05; 5:267
Q6248294;Wästfelt i Umeå senare Stockholm; Axel G;1821-04-07; 5:380
Q6250579;Zachrison i Vänersborg; J Mats G;1841-05-24; 4:282
Q6254167;von Zweigbergk i Stockholm; Otto F;1863-05-23; 3:156
Q6255044;Åkerberg i Värö; C Fredrik O;1837-12-15; 2:406
Q6255102;Åkerblom i Göteborg; Fredrik;1839-06-09; 4:176
Q6255169;Åkerhielm af Blombacka i Högfors; H S Knut;1809-10-15; 1:461
Q104889258;Åkerhielm af Margretelund i Landskrona; B C Alexander B;1830-07-07; 3:292
Q6255141;Åkerhielm af Margretelund i Örebro; J Carl;1807-07-21; 4:522
Q6255431;Åkerman i Stockholm; A Richard;1837-04-10; 4:451
Q6255508;Åkeson-Lundegård i Landskrona; J C Evald;1827-04-25; 3:292
Q6255597;Åkesson i Raskarum; Johannes A;1872-10-30; 3:157
Q6255636;Åkesson i Södra Sandby; Nils;1836-05-05; 3:293
Q104840074;Åstrand i Graby; Janne A;1828-09-20; 2:120
Q6256250;Öberg i Landskrona; Johan August;1842-10-03; 3:293
Q6256529;Ödström i Hasselby senare Asker; Petrus;1868-05-14; 2:318,  4:524
Q6256634;Öhlin i Tollsta; Laurentius;1811-01-22; 1:280
Q6257002;Ölander i Sundsvall; A Herman;1841-11-11; 5:270
Q6257423;Örtqvist i Gräsmark; Johannes;1833-01-26; 4:452
Q6258079;Östling i Linköping; Nils;1830-04-05; 2:121
Q6258229;Östman i Ry; Per;1805-10-17; 5:271
Q26211952;Persson i Bromma; E Margareta;1950-12-28; 1:101
Q117428029;Westerberg i Malmö; Elvy V;1932-09-01; 1:487
