id,type,tag,box,content
"https://betalab.kb.se/prot-1942--fk--21#1-107-cblock_1-block_1",Text,1,"89,258,1509,125","Ang. vägväsendets förstatligande. (Forts.)\nde av vägmaskinerna, och jag tror till och med att några ha vågat påstå, att\ndet hela också skulle bli billigare.\n"
"https://betalab.kb.se/prot-1942--fk--21#1-107-cblock_1-block_2",Text,1,"87,386,1513,636","Jag för min del, herr talman, tror att det enda skälet för ett förstatligande,\nnär det kommer till praktiken, just är skatteutjämningen. Och därvidlag\nmåste man utan tvivel säga, att man kan ha anledning att fundera ett slag.\nMen när det gäller de andra sidorna av saken kommer man in på problemet,\nvar den gräns går, där en arbetsorganisation är som mest rationell. Och då\nvet man, att man kommer upp till en alltför stor organisation och man överskrider\n den gräns, där svårigheterna bli större att få det hela rationellt skött.\nDet beror på rent tekniska orsaker, men även på psykologiska. Hittills har\ndet varit så att med den storlek, som vägdistrikten ha, har en maskinpark\nkunnat fullkomligt utnyttjas. Det enda undantaget skulle möjligen kunna\nvara de stora och dyrbara och sällan brukade aggregat, som användas vid\nhelpermanentning av vägar, och dessa bruka lånas melian distrikten, men alla\növriga maskiner äro av den art och beskaffenhet, och det kommer sannolikt\natt så förbli, att vägdistrikten äro tillräckligt stora enheter för att fullständigt\n kunna utnyttja dem.\n"
"https://betalab.kb.se/prot-1942--fk--21#1-107-cblock_1-block_3",Text,1,"88,1021,1512,546","Vad jag närmast är rädd för är att arbetsorganisationen kommer att bli lika\ndålig som man har andra exempel på inför ögonen nästan varje dag på landsbygdens\n Dessa exempel äro så påtagliga, att jag tycker att man skulle hesitera\nför att skaffa fler. Felaktigt sammansatta arbetslag, för dålig arbetseffekt\noch en bristande övervakning tror jag kommer att bli följden. Och när man\nframför sådana skäl som att ett förstatligande skulle vara nödvändigt för\nden militära beredskapen, tycker jag också att man bevisar alltför mycket.\nTy först och främst lär väl inte, även om Kungl. Maj:t, såsom herr Björnsson\n önskade, raskar på med att effektuera beställningen av omorganisationen,\ndenna omorganisation bli färdig, hinna verka och avsätta resultat inom det\nnärmaste decenniet. Och sedan har man kanske någon tid på sig, så att man\nåtminstone kan göra huvudvägarna i ordning till nästa krig. Jag tror därför\ninte att man kan anföra detta som ett argument.\n"
"https://betalab.kb.se/prot-1942--fk--21#1-107-cblock_1-block_4",Text,1,"88,1571,1514,927","Mig förvånar en liten smula den förvåning, som herr Bärg uttalade, när han\ninte begrep dem på landsbygden, som inte tackade ja till denna gåva från\nhöjden. Samtidigt begrep han inte heller, varför inte stadsborna protesterat. Just\nden omständigheten att det är som det är utgör, menar jag, ett bevis för att\ndet måste finnas skäl — annars hade de nog gjort just det. som herr Bärg\nförvånade sig över att de inte gjort. Jag tror att den stora mängden människor\ni de trakter, där vägväsendet är dåligt utvecklat, men där hoppet ännu finns\nkvar om att det skall bli bättre, betraktar teknikerna, vägingenjörerna, som\nde någon gång ha sett och rätt ofta hört talas om, på det sättet, att inte ens\nett erbjudande om en gåva att bli av med vägskatten kan locka. Om de talade\nlatin skulle de nog säga någonting som så: »Quidauid id est timeo danaos et\ndona ferentes» — de vilja inte ha några gåvor som de tro komma att medföra\natt de bli helt och hållet bortglömda i framtiden. Och de som bo i städerna, eller\nrättare sagt de av städernas befolkning, som främst hade anledning att protestera,\n ha nog den lilla baktanken, att genom den nya organisationen komma de\nstora stråkvägarna att bli bättre tillgodosedda. Huvuddelen av deras automobilskattemedel\n och även de direkta skatter, som de kunna få betala, kommer\n att användas på de vägar, som de mest åka på, och därför äro de villiga\natt taga på sig en något högre beskattning. Och därför protestera de inte heller.\n Just den omständigheten att de inte protestera är måhända ett motiv för\natt det ligger någonting i att många på landsbygden inte vilja taga emot en\ngåva som denna.\n"
"https://betalab.kb.se/prot-1942--fk--21#1-107-cblock_1-block_5",Text,1,"140,2495,1461,42","Vad beträffar det som utgör det väsentligaste inslaget i dagens frågeställ-\n"
