id,type,tag,box,content
"https://betalab.kb.se/prot-1930--ak--31#1-30-cblock_5-block_5",Text,1,"291,236,1499,163","ligen fåfängt. Men nog har jag vid samtal under hand med åtskilliga riksdagsledamöter\n fått den uppfattningen, att belåtenheten med det av utskottet föreslagna\n arrangemanget ingalunda är så allmän, som man av det tämligen enhälliga\n utskottsbetänkandet skulle kunna föranledas förmoda.\n"
"https://betalab.kb.se/prot-1930--ak--31#1-30-cblock_5-block_6",Text,1,"289,404,1502,332","Emellertid har utskottet vidtagit en förändring på en punkt, som jag ber\natt särskilt få framföra till beaktande. Den gäller begränsningen av utdelningen\n på aktierna. Utskottet har letts av den känslan och tanken, att det här\nicke finge lämnas något utrymme för eventuella strävanden hos Kungl. Maj il\natt genom direktiv till tobaksmonopolets ledning tillföra statskassan större inkomst,\n än som riksdagen till äventyrs skulle ha avsett — korteligen : Inkomsten\nav det i rörelsen investerade kapitalet skulle vara ringa och bestämd en gång för\nalla, och vad därutöver skulle uttagas, borde uttagas skattevägen.\n"
"https://betalab.kb.se/prot-1930--ak--31#1-30-cblock_5-block_7",Text,1,"287,739,1504,583","Mot tanken i och för sig har jag intet att erinra; jag har för övrigt många\ngånger hört den framföras. Men å andra sidan måste man medge, att den inkomst,\n som utöver beskattningsvägen skall tillföras staten och måste tillföras\nstaten, så länge företaget är organiserat som affärsföretag, den inkomsten kan\nicke ändamålsenligt begränsas så snävt, som utskottet gjort, då utskoitet bundit\n utdelningen till 5 Z. Det blir en vinst på 1,450,000 kronor å statens aktieinnehav,\n och med den ofantliga omslutning, som denna affär har, kan man icke\nutan synnerlig svårighet balansera rörelsen, så att vinsten på detta sätt begränsas.\n Det har utskottet förutsett, och därför har man inrättat en vinst- och prisregleringsfond,\n som skall uppsamla överskottet, för att sedermera vid eventuellt\ninträffat underskott lämna en tillgång till täckning. Saken kan naturligtvis\nordnas på detta sätt, men att det blir svårigheter är tydligt, och att de komma\natt föranleda icke önskvärda åtgärder i fråga om bokslutet, det förutser jag som\nen ganska nödvändig följd av detta arrangemang.\n"
"https://betalab.kb.se/prot-1930--ak--31#1-30-cblock_5-block_9",Text,1,"285,1704,1506,793","Utskottet säger 1 fråga om denna räntesats endast följande: »Enligt propositionen\n har utdelningen å preferensaktierna föreslagits till 6 procent, vilken\nskulle garanteras av staten. Då hinder säkerligen icke torde möta för aktiernas\nplacering hos lämpliga personer, även med en något lägre utdelning, har utskottet\n föreslagit, att denna begränsas till 5 procent.» Utskottet fäster sig\ntydligtvis vid det för närvarande exceptionellt billiga ränteläget och menar, att\ndet skall bliva lätt att placera dessa aktier till 5 procent. Ja, om det gäller att\nplacera dessa aktier hos kapitalister, kan man driva den satsen. När det gäller\nen så trygg placering, skall man nog kunna finna personer, som äro villiga att\nplacera det erforderliga beloppet. Men det är här inte fråga om att finna kapitalister,\n som vilja placera penningar, utan meningen är att finna för uppdraget\n lämpade medborgare. Och det förefaller, såsom det icke vore ett demokratiskt\n drag hos majoriteten inom bevillningsutskottet att på detta sätt förutsätta,\n att det just skulle vara kapital, man borde söka. Det är människor man\nsöker, mina herrar, och dessa människor äro säkerligen i stor utsträckning icke\nkapitalister, åtminstone är det absolut icke önskvärt, att man förutsätter det,\nutan att man räknar med att de behöva belåna dessa aktier. Ja, för dagen kunna\n de kanske belånas med 5 Zz, men detta gäller ett engagemang för sex år framåt.\n Jag har skaffat mig en uppgift från riksbanken angående räntan vid aktie-\n"
"https://betalab.kb.se/prot-1930--ak--31#1-30-cblock_5-block_8",Text,1,"286,1325,1519,376","Den huvudsakliga olägenheten med detta arrangemang från min synpunkt\nsett, det är dock, att man låter preferensaktiekapitalet följa stamaktiekapitalet\noch binder även detta vid 5 Z. Som herrarna erinra sig, är avsikten såväl i tobaksmonopolet\n som i spritmonopolet, att det enskilda intresset skall organiseras\nupp på det sättet, att Kungl. Maj:t utser ett visst antal enskilda medborgare,\nsom övertaga ett visst antal aktier. Man fordrar av dessa medborgare, att de\nskola ha både intresse för saken och förutsättningar för att kunna tillsätta det\nantal styrelsemedlemmar, som det ankommer på bolagsstämman att utse, och -\nbevaka de affärsmässiga synpunkterna, såvitt de kunna ankomma på stämman.\n"
