id,type,tag,box,content
"https://betalab.kb.se/prot-197980--42#1-36-cblock_5-block_5",Text,1,"338,116,813,59","Därefter kan nämnas strukturutredningen — vid vars tillkomst de fackliga\norganisationerna i norr drog det kortaste strået.\n"
"https://betalab.kb.se/prot-197980--42#1-36-cblock_5-block_6",Text,1,"337,186,813,200","Genomförandet av strukturplanen har hittills för NJA:s del medfört att\nföretagsledningen flyttats till Stockholm, datacentralen har flyttats till\nGrängesberg, forsknings- och utvecklingsavdelningen har flyttats till Borlänge,\n sinterverket, kokillgjuteriet, bandvalsverket, götverket och finvalsverket\n har lagts ned, armeringsverkstaden har avvecklats, och nu finns\ntecken som tyder på att även Plannja är i farozonen.\n"
"https://betalab.kb.se/prot-197980--42#1-36-cblock_5-block_7",Text,1,"335,397,814,197","Med andra ord: all vidareförädling av råstål har flyttats från Luleå. Det har\nskett helt i enlighet med strukturplanen, men det kan knappast vara i enlighet\nmed en målsättning för industriell utveckling av länet. I det här sammanhanget\n kan det vara värt att upprepa en vid flera tillfällen framförd uppgift,\nnämligen att importen av handelsstål uppgår till hela 57 926 av det totala\nsvenska behovet.\n"
"https://betalab.kb.se/prot-197980--42#1-36-cblock_5-block_8",Text,1,"332,609,816,165","För NJA:s del kan också sägas att interna utredningar inom företaget har\nkommit fram till att det finns behov av att bygga ett förpar i valsverket för att\neffektivisera detta valsverk. Det finns medel, men ledningen vägrar att göra\nden nödvändiga investeringen. Borde inte de organ inom departementet som\nindustriministern nämner i sitt svar också påtala sådana stora missgrepp?\n"
"https://betalab.kb.se/prot-197980--42#1-36-cblock_5-block_9",Text,1,"331,786,815,411","Så malmbanan och Luleå malmhamn. Här fattade riksdagen ett beslut att\nanslå 250 milj. kr. till upprustning, trots att det verkliga behovet rörde sig om\n500 milj. kr. Man överlät också åt fackmyndigheter att avgöra hur de\notillräckliga medlen skulle användas och kom därigenom ifrån det politiska\nansvaret. Vpk arbetade i den här frågan för att få till stånd en upprustning\näven av det södra omloppet. En sådan inriktning har betydelse för verksamheten\n vid Luleå hamn, ja, man skulle kunna säga att Luleå hamns framtid\nsom exporthamn hänger på frågan om malmbanans södra omlopp. Det har\nockså betydelse när det gäller underlag för isbrytarservicen i Bottenviken, och\ndet är inte heller svårt att se sambandet med verksamheten vid Karlsborg och\nASSI i Piteå. I det här sammanhanget kan nämnas att Luleå har 116 96 högre\nmalmavgifter än hamnen i Narvik. Varför får det tillståndet fortsätta?\n"
"https://betalab.kb.se/prot-197980--42#1-36-cblock_5-block_10",Text,1,"330,1208,816,234","Efter riksdagens beslut om upprustning av malmbanan har det dessutom\ninträffat att ledande personer — såväl inom LKAB som på det politiska fältet —\nhar kommit fram till att det borde gå att göra direktreducerat stål av kulsinter\nfrån Kiruna och norsk Nordsjögas. Var då, frågar man sig. Tänker man på den\nnorska Atlantkusten? Den konkreta frågan undviker industriministern att gå\nin på i sitt svar. Är det därför att industriministern inte känner till de här\nidéerna? Om inte, varför tar industriministern inte upp denna tanke?\n"
"https://betalab.kb.se/prot-197980--42#1-36-cblock_5-block_11",Text,1,"329,1454,814,165","Så till frakttaxorna. Detta är ett annat påtagligt exempel på det som min\ninterpellation gäller. Vi vet att SJ tar ut höga taxor för transporterna av malm\nmellan Malmberget och Luleå. Däremot dumpas priserna på frakter av\nstålämnen mellan Luleå och Borlänge, vilket naturligtvis också hotar\nexporthamnen i Luleå.\n"
"https://betalab.kb.se/prot-197980--42#1-36-cblock_5-block_12",Text,1,"330,1631,814,94","Boardfabriken i Piteå har säkert vid det här laget blivit ett välbekant\nbegrepp för industriministern, inte minst på grund av den aktivitet som har\nutvecklats bland hans egna partivänner i denna fråga. Verksamheten går bra,\n"
