id,type,tag,box,content
"https://betalab.kb.se/prot-1951--ak--2#1-54-cblock_3-block_3",Text,1,"282,308,720,826","följdes till punkt och pricka av Japan\nså långt krafterna det tilläto, bör det\ninte förvåna att kineserna inte ville se\namerikanska trupper på samma farliga\nväg. De visste, att den amerikanska regeringen\n satsat över trettio miljarder\nsvenska kronor för sin agent Chiang\nKai-sheks krig mot folkrevolutionen.\nDe visste också, att amerikanarna berövat\n dem deras plats i Förenta Nationerna,\n ockuperat kinesiskt område,\nträngt fram till landets gränser i nord\noch syd, och på åtta veckor, från den\n27 augusti till den 19 november, företagit\n 151 flygraider över kinesiskt territorium\n med upp till 68 plan i stöten\noch därvid ödelagt kinesisk egendom\nsamt sårat och dödat kinesiska invånare.\n\n"
"https://betalab.kb.se/prot-1951--ak--2#1-54-cblock_3-block_4",Text,1,"283,1150,721,701","Jag medger att en sak kan ses på ett\nannat sätt av en socialdemokratisk regering\n i Stockholm än av folk som befinna\n sig mitt i kriget i Östasien. Jag\nmåste till och med konstatera, att folkpartikronprinsen\n Waldemar Svensson i\nLjungskile anser moralen kräva att Kina\nstämplas som angripare — detta ligger\nhelt i linje med den som 1935 ansåg att\ndet var Abessinien som angripit Italien.\nOm Kina i dag intervenerat i Mexiko\noch attackerat amerikanskt territorium\n10 000 kilometer från sitt eget land,\nskulle herr Svenssons i Ljungskile logik\n även kunnat medge att amerikanerna\n stämplades som angripare.\n"
"https://betalab.kb.se/prot-1951--ak--2#1-54-cblock_4-block_6",Text,1,"1056,305,721,391","moral heter vid sitt ställningstagande\ntill den amerikanska interventionen i\nKorea! Då är det enklare för herr\nSvensson i Ljungskile att liksom Morgon-Tidningen\n för någon vecka sedan\nsläpa fram Kaiser Wilhelms gamla spöke,\n den gula faran, till politiskt tillhygge\n — så långt det nu kan gå att försvara\nden politik som förts mot Korea.\n"
"https://betalab.kb.se/prot-1951--ak--2#1-54-cblock_4-block_7",Text,1,"1057,705,723,1270","Jag har svårt att tänka mig något\nmera omoraliskt än den amerikanska\nkrigföringen i Korea, det framgångsrika\n ödeläggandet av de koreanska städerna,\n fabrikerna, hamnarna, gruvorna,\nskolorna, sjukhusen och bostäderna.\nJag läste det triumferande telegrammet\n att Söul, en stad med dubbelt så\nstor befolkning som Stockholm, förvandlats\n till en rykande askhög när\namerikanerna lämnade staden. Jag läste\nför månader sedan, att det inte längre\nfanns något kvar av värde för det amerikanska\n flyget att bomba och ödelägga\ni Nordkorea. Jag läste många amerikanska\n korrespondenser, där det bittert\nbeklagades att bombflyget inte fick\nbörja med en systematisk ödeläggelse av\nKinas industrier och kommunikationer.\nDen nordkoreanska huvudstaden Pjongjang\n tillhörde också dessa fullständigt\nödelagda och nedbrända städer, som\nbära vittne om de amerikanska truppernas\n framfart. När , man talar om\nmoral, bör man heller icke glömma uppgiften\n om de 12000 koreaner som avrättades\n under de ohyggliga månader,\ndå amerikanerna voro Pjongjangs herrar.\n\n"
"https://betalab.kb.se/prot-1951--ak--2#1-54-cblock_3-block_5",Text,1,"284,1860,721,657","Jag är inte säker på att jag tolkar\nstatsministerns ilskna fnysning mot\nherr Svensson i Ljungskile rätt, men jag\nvill gärna återge hans polemik, den har\nju också något cirkulerat i debatten\nhär: »Denna fariseiska hållning, där\nman betraktar sitt eget ställningstagande\n som utslag av en hög moral och\nunderkänner de moraliska motiven för\nmotståndarnas handlingssätt, förgiftar\ndiskussionen och bidrar till att förstora\nde nyanser i bedömningen som kunna\nfinnas. Skillnaden ligger inte på det\nmoraliska planet.» Nej just det, jag tycker\n att man skall koppla bort allt vad\n"
"https://betalab.kb.se/prot-1951--ak--2#1-54-cblock_4-block_8",Text,1,"1057,1992,723,523","Från Söul lämnade ju även den engelsk-amerikanska\n underrättelsetjänsten\n— jag erinrar om ett Reutertelegram\nfrån i fjol, som gick i hela pressen —\nett lärorikt material om det industriellt\n fulländade sätt, varpå ståndrätterna\narbetade. Män, kvinnor, ungdom och\nbarn skötos utan urskillning, även spädbarn\n vid sina mödrars bröst, ungar\nsom nyss lärt sig gå eller ungar som\nvi sända till de första skolklasserna.\nMärkligast var den officiella motive-\n"
