id,type,tag,box,content
"https://betalab.kb.se/prot-198687--50#1-38-cblock_1-block_1",Text,1,"55,124,1072,63","Jag kommer att uppehålla mig vid ett ämne som är viktigt för riksdagsmän—  Prot. 1986/87:50\nnen, nämligen riksdagens roll som lagstiftare. 16 december 1986\n"
"https://betalab.kb.se/prot-198687--50#1-38-cblock_1-block_2",Text,1,"54,196,1082,261","Betänkandet innehåller framflyttning av en bråkdel av den kommande. ZI\nbanklagstiftningen, nämligen filialetablering. Detta saknar egentligen intresse,\n herr talman, eftersom det inte föreligger någon strid i denna fråga. Vad\nsom däremot inte saknar intresse är det faktum att den ansvarige ministern,\nstatsrådet Bengt K. Å. Johansson, som har hand om dessa lagstiftningsfrågor,\n inför allt folket har avslöjat en syn på banklagstiftning, och uppenbarligen\n också på riksdagens civillagstiftningsrätt, som är värd att uppmärksamma\n och kommentera här i riksdagen.\n"
"https://betalab.kb.se/prot-198687--50#1-38-cblock_1-block_3",Text,1,"54,466,809,659","I hela världen finns det banklagstiftning. Denna är tillkommen för ett\nsyfte, nämligen att säkra insättarnas pengar. Detta är också den svenska\nbanklagstiftningens huvudinriktning. I 1955 års banklagstiftning, som alltjämt\n gäller, finns egentligen inga uttryck för hur lagstiftaren vill se ägarrollen\nkonstituerad i bankerna. När det gäller den nya lagstiftningen, som\nbehandlades så sent som i september 1986, alltså för bara några månader\nsedan, föredrogs förslag till en ny bankrörelselagstiftning, som på denna\npunkt egentligen bara innehåller en nyhet, nämligen den att man nu är\nberedd att acceptera att utländska banker får etablera sig i Sverige. Detta är\nsåledes en alldeles klar markering av att man är beredd att acceptera ett\nkoncentrerat ägande av bankrörelseverksamhet i Sverige. När då Bengt\nK. Å. Johansson i fredagens Dagens Industri går ut och påstår att det finns en\nbanklagstiftningens anda som tar sig uttryck i regler på ägarsidan, menar jag\natt detta statsråd gör sig skyldig till övergrepp mot riksdagens lagstiftningsmakt.\n Han intolkar i lagen ett begrepp som inte finns och söker uppenbarligen\n därmed påverka bankinspektionen och säkerligen också den sittande\nkreditmarknadsutredningen. Och detta är en fråga som mycket väl kan\nuppmärksammas. Man kan ju konstatera att statsrådet Bengt K. Å. Johansson\n också har observerat sitt övertramp. Allteftersom dagarna går företar\nhan allt fler reträtter.\n"
"https://betalab.kb.se/prot-198687--50#1-38-cblock_1-block_4",Text,1,"56,1140,807,124","Jag har emellertid velat göra riksdagen uppmärksam på denna fråga, och\njag hoppas att rikdagsmännen slår vakt om riksdagens civillagstiftningsrätt\noch slår tillbaka de angrepp mot denna rätt som förekommer ifrån den nu\nsittande regeringens sida.\n"
"https://betalab.kb.se/prot-198687--50#1-38-cblock_4-block_8",Text,1,"57,1409,807,126","Herr talman! Den lagstiftning, Nic Grönvall, som behandlas av näringsutskottet\n är ju mera av formell karaktär. Kreditmarknadskommittén har till\nuppgift att göra de fortsatta utredningarna och övervägandena. Tids nog lär\nvi få tillfälle att diskutera frågan.\n"
"https://betalab.kb.se/prot-198687--50#1-38-cblock_4-block_9",Text,1,"58,1540,1064,198","Beträffande Bengt K. Å. Johanssons uttalanden, som Nic Grönvall\naktualiserade under denna punkt, förhåller det sig självfallet så, att en\nledamot av regeringen får framföra sina uppfattningar. Enligt min mening\nhar inte Bengt K. Å. Johansson gjort detta på annat sätt än vad som är\nacceptabelt och riktigt. I den mån Nic Grönvall har någonting ouppklarat\nmed Bengt K. Å. Johansson finns det ju lämpliga institut i riksdagen att 37\n"
