id,type,tag,box,content
"https://betalab.kb.se/prot-1942--ak--19#1-65-cblock_1-block_2",Text,1,"109,331,1511,464","att jag anser, att denna praxis skulle behöva vara förpliktande att följa även\ni detta fall, utan av den anledningen att jag vet, att kammaren följer utskottet\n1 vått och torrt, kan jag väl säga, vare sig de beslut som föreslås därifrån äro\nvälbetänkta och rättvisa eller inte. Praxis härvidlag är ju inte så alldeles förpliktande,\n ty jag kan upplysa motionären om att om någon vecka kommer på\nkammarens bord en fråga om avsättning till investeringsfonder, föranledd av\nen proposition som avlämnats i år. Där föreslår utskottet, att de nya reglerna\nskola tillämpas redan vid taxeringen i år. Där har man alltså ansett sig kunna\nbortse från praxis. Det är Kungl. Maj:t som där gör ett förslag. Men i detta\nfall håller man på praxis därför att det är herr Wiberg, som är förslagsställare.\nJag antar att man får säga, att detta är den verkliga motiveringen.\n"
"https://betalab.kb.se/prot-1942--ak--19#1-65-cblock_1-block_3",Text,1,"108,798,1509,377","Jag har vidare inom utskottet anfört, att jag trodde det fanns en hel del\ngåvor, som voro skänkta på vår västkust föregående år, och att det därför\nskulle ha en viss praktisk betydelse, att skattefrihet kunde medges redan vid\nårets taxering. Men ett sådant argument har ju inte haft större inflytande på\nutskottets inställning än övriga argument, som jag anfört. Jag kan inte tänka\nmig, att det i detta fall kan gå att lösa svårigheterna på annat sätt än att vederbörande\n givare kan få gåvorna betraktade såsom skänkta i år i stället. Då\nskulle han kunna få den skattebefrielse, som nu är medgiven vid nästa års\ntaxering.\n"
"https://betalab.kb.se/prot-1942--ak--19#1-65-cblock_1-block_4",Text,1,"154,1179,704,38","Herr talman! Jag har intet yrkande.\n"
"https://betalab.kb.se/prot-1942--ak--19#1-65-cblock_2-block_5",Text,1,"108,1263,1508,251","Herr Olsson i Gävle: Jag nödgas, herr talman, korrigera några av de uppgifter\n herr Lundell så välvilligt strödde omkring sig. I fråga om investeringsfonderna\n föreligger ju den lilla skillnaden, att den lagstiftning som nu föreslås\n till övervägande del är avsedd att ersätta en lag, som ägt tillämpning sedan\n 1938. Om man inte kopplat ihop dessa frågor, skulle två lagar samtidigt\nha kommit att gälla beträffande investeringsfonderna.\n"
"https://betalab.kb.se/prot-1942--ak--19#1-65-cblock_2-block_6",Text,1,"106,1517,1508,335","Jag nödgas vidare beröva herr Lundell glädjen att spänna herr Wiberg för\nsin vagn. Herr Lundell sade, att det är klart att om Kungl. Maj:t hade framställt\n förslaget, så hade det gått bra — utskottet bara sväljer vad Kungl.\nMaj:t föreslagit — men nu har herr Wiberg gjort det, och då går det inte.\nHerr Wiberg erinrar sig säkerligen, att det för bara några veckor sedan låg\nen kungl. proposition på riksdagens bord, i vilken på förslag av motionärer,\nbland vilka fanns herr Wiberg, det gjordes avsevärda ändringar i utskottet.\nSådan ser verkligheten ut och inte som herr Lundell skildrade den.\n"
