id,type,tag,box,content
"https://betalab.kb.se/prot-1952--ak--7#1-24-cblock_2-block_2",Text,1,"274,289,728,1315","av Öststaternas delegater, kommissionen\nmed all sannolikhet inte skulle ens kunna\n börja sitt arbete. Det bör märkas att,\nom kommissionen vägras tillträde till\nöstzonen, en begränsning av dess undersökning\n till västzonen enligt förslaget\nicke skulle ifrågakomma, en ståndpunkt\nsom för övrigt synes ha fog för sig. Det\nsvenska förslaget skilde sig från västmaktsförslaget\n i två hänseenden. Det innebar\n för det första att omgången med\nen undersökningskommission slopades\noch att i stället frågan om fria val såsom\n förberedelse till en återförening av\nTyskland hänsköts direkt till de fyra\nockupationsmakterna. Dessa skulle inom\nen månad rapportera om resultatet av\nsina förhandlingar inbördes och med\ntyska delegater. Därest ett positivt resultat\n framginge ur dessa förhandlingar,\nskulle FN vara berett att lämna sin medverkan\n på sätt nyss antyddes. För det\nandra ingick i det svenska förslaget en\nförklaring från FN om dess beredvillighet\n att erbjuda sina tjänster om och när\nen principiell överenskommelse träffats\nmellan de intresserade parterna. Denna\nsenare punkt upptogs i ett ändringsförslag\n till västmakternas resolution och\nblev sedan accepterad av dessa.\n"
"https://betalab.kb.se/prot-1952--ak--7#1-24-cblock_3-block_3",Text,1,"273,1621,729,882","På sina håll bland anhängarna av\nvästmaktsförslaget har man tydligen menat,\n att det kunde från början anses givet,\n att någon uppgörelse om fria val\nicke för närvarande är att vinna. Genom\ntillsättandet av kommittén och det väntade\n avslaget på dennas begäran att få\ntillträde till östzonen för undersökning\nav olika förhållanden, skulle man, enligt\n denna tankegång, klargöra att motståndet\n mot fria val och mot garantier\nför valfriheten kommer från Östtyskland\noch Sovjetunionen. När emellertid en\npolitisk fråga hänskjutes till FN, bör\ndess vederbörande organ enligt vår mening\n icke onödigtvis engagera sig för\nen procedur som måste presumeras vara\noframkomlig på grund av ena partens\nhållning. Däremot kan givetvis FN avskriva\n ärendet, sedan det efter ett opar-\n"
"https://betalab.kb.se/prot-1952--ak--7#1-24-cblock_5-block_5",Text,1,"1055,292,730,125","tiskt förfarande konstaterats, att förutsättningar\n för fortsatt behandling av saken\n från FN:s sida icke föreligga.\n"
"https://betalab.kb.se/prot-1952--ak--7#1-24-cblock_6-block_6",Text,1,"1054,433,732,690","3. Frågan om upptagandet av nya\nmedlemmar har grundligt debatterats i\nFN:s församling sedan 1947 års möte.\nFrån svensk sida har konsekvent den\nståndpunkten hävdats, att FN bör eftersträva\n universalitet. Eftersom ingen inträdesansökan\n kan bifallas utan att säkerhetsrådet\n med stadgad röstövervikt\ntillstyrker ansökningen, ha debatterna\ni församlingen och där antagna resolutioner\n endast kunnat uttrycka en opinion\n som icke binder säkerhetsrådet.\nVid flera tillfällen ha från svensk sida\nresolutionsförslag framställts, vari hänvisats\n till önskemålet att FN blir universellt.\n\n"
"https://betalab.kb.se/prot-1952--ak--7#1-24-cblock_6-block_7",Text,1,"1054,1144,731,477","Det dödläge, som sedan länge varit\nrådande i denna fråga, bestod ursprungligen\n däri att ett flertal delegationer,\nmed USA i spetsen, vägrade tillstyrka\nansökningar från en grupp »folkdemokratiska»\n stater, medan Sovjetunionen\nvägrade ge sin röst åt vissa andra stater\neller ock gjorde sin röstning för dessa\nsenare beroende av att motsidan gav\nsitt stöd åt de av Sovjetunionen förordade\n ansökningarna.\n"
"https://betalab.kb.se/prot-1952--ak--7#1-24-cblock_6-block_8",Text,1,"1054,1630,731,346","Under de sista åren har Sovjetunionens\n ståndpunkt mildrats på det sätt,\natt den ryska delegationen varit beredd\nacceptera en uppgörelse, varigenom\nsamtliga inträdesansökningar «(utom\nKoreas) skulle tillstyrkas, medan USA\njämte åtskilliga andra stater icke velat\ngodtaga en dylik kompromiss.\n"
"https://betalab.kb.se/prot-1952--ak--7#1-24-cblock_6-block_9",Text,1,"1054,1983,731,169","De voteringar, som ägde rum i denna\nfråga, tyda på att tanken på en kompromiss\n efter nyss antydda linjer vunnit\nallt större anslutning.\n"
"https://betalab.kb.se/prot-1952--ak--7#1-24-cblock_6-block_10",Text,1,"1053,2159,732,344","4. Församlingen hade att behandla en\nrapport, avlämnad av den utredningskommitté,\n som enligt beslut av 1950 års\nförsamling skulle närmare studera tilllämpningen\n av sanktioner gentemot en\nfredsstörare. Kommitténs betänkande utmynnade\n i åtskilliga anvisningar för\nFN:s organ och för medlemsstaterna,\n"
