id,type,tag,box,content
"https://betalab.kb.se/prot-1928--fk--19#1-39-cblock_0-block_1",Text,1,"107,226,1721,811","Jakten inte får bedrivas annat än på det eller det sättet, annars faller den under Om humanitär\nstrafflagsbestämmelserna för djurplågeri. Jag har verkligen kommit i kon- pj; jakt nm.\ntakt med ett par hyggliga yrkesjägare och fått lära mig en del saker om vad = (Forts)\nde anse för fair play och motsatsen i fråga om jakt. De ha sagt, att det före- |\nkommer en mängd onödigt djurplågeri under jakten. TI så fall skulle man väl\n1 Jaktstadgan kunna specificera vad som av det, som praktiseras under jakt,\nmåste anses för djurplågeri, så att man således skulle kunna lättare komma åt\ndetta genom strafflagen. Som exempel på dylika metoder, som borde vara\notillåtna, skulle jag vilja nämna att skjuta på måfå på ett djur, utan att det\nfinnes någon större sannolikhet för att man träffar, så att det verkligen stupar\noch slipper lida kval. Likaså borde det vara förbjudet att skjuta bakifrån.\nNågonting, som inte heller skulle få förekomma, är drevjakt. Dessa jägare\nsade, att en hedervärd jägare föraktar drevjakten och absolut skulle neka till\natt vara med om sådana tillställningar, där man med hundar och drevkarlar\ndriver fram en massa villebråd, som sedan skjutes ned på måfå. Det blir bara\nen ren, djurisk slakt, som inte fyller något förnuftigt samhällsbehov. Det var\nf. ö. en hel del sådana saker, som dessa jägare räknade upp och av vilka jag nu\nframdragit tre exempel. Alla borde de nämnas i stadgan, och jag föreställer\nmig, att utskottet inte bör ha några invändningar att göra mot en sådan sak.\n"
"https://betalab.kb.se/prot-1928--fk--19#1-39-cblock_0-block_2",Text,1,"106,1041,1512,582","Mitt andra yrkande innebär en effektiv begränsning av nöjesjakten. Utskottet\n har sagt, att det är svårt att skilja mellan nöjesjakt och icke nöjesJakt.\n Det kan ju vara riktigt, men man kan i alla fall förbjuda jakt, som tillställes\n enbart för nöjes skull. Det förekommer t. ex. stora jaktpartier, som ge\nsig av långt från hemorten, inte för att skjuta till husbehov eller driva jakt på\negna ägor. Jakter arrangeras 1 fjällen, i havsbandet och i de stora skogarna,\noch dit fara stora jaktpartier från huvudstaden och andra orter, vilka jaktpartiers\n deltagare endast för nöje skull resa bort för att skjuta, med andra ord\nplåga, djuren, och detta sker utan något annat förnuftigt ändamål än för att\nutgöra ett bidrag till mänsklighetens bibehållande, även på höjderna, i ett\nvisst medeltidsbarbari, som detta egentligen är. Nöjesjakten är ju en kvarleva\nfrån medeltiden, en kvarleva, som det visserligen är svårt att utrota men som\nman 1 alla fall bör försöka finna vissa gränser för, så att de ännu rådande\nbarbariska förhållandena avlöstes av bättre.\n"
"https://betalab.kb.se/prot-1928--fk--19#1-39-cblock_0-block_3",Text,1,"107,1632,1508,291","För det tredje har jag yrkat, att i varje fall en väsentlig avlysning av nöjesJakten\n från kronans marker skulle föreskrivas. I det avseendet har ju kronan\n1 sin hand att säga, att dess mark inte står öppen för sådan nöjesjakt, ty denna\n har, som jag säger, intet förnuftigt ändamål. Den bara bibehåller ett barbari\n i nationens medvetande, och det bibehålles genom de högre och mera ledande\n samhällsklasserna, som ägna sig åt sådana nöjen, vilka inte borde få\nvara nöjen.\n"
"https://betalab.kb.se/prot-1928--fk--19#1-39-cblock_0-block_4",Text,1,"152,1927,723,38","Jag yrkar således bifall till motionen.\n"
"https://betalab.kb.se/prot-1928--fk--19#1-39-cblock_1-block_5",Text,1,"106,2054,1511,461","Herr Sederholm: Jag kan fatta mig ganska kort efter den, jag vågar säga,\nmilda kritik, som utskottets utlåtande här har varit utsatt för. Denna mildhet\n utgör ju egentligen ett erkännande av styrkan hos de skäl, som utskottet\nanfört för sitt avslagsyrkande. De försök, som motionären här har gjort att\nprecisera till att börja med direktiven för en förändring av jaktlagstiftningen.\ntorde inte vara sådana, att man egentligen kan tänka sig att få in dem i en\nlag eller jaktstadga. Det kräves ju vida mer distinkta formuleringar än att\nt. ex. förbjuda drevjakt eller att skjuta ett djur bakifrån eller under sådana förhållanden,\n att man inte har sannolikhet för att döda det. Skulle sådant vara i\nlag förbjudet, komme det ju att medföra oövervinneliga svårigheter i lagtilllämpningen.\n\n"
