id,type,tag,box,content
"https://betalab.kb.se/prot-1957--ak--19#1-84-cblock_3-block_3",Text,1,"277,322,718,563","har ju själv skapat den svaga ställningen\n genom de ålägganden företaget fått.\nI övrigt har det sedan länge varit möjligt\n att i de offentliga bolagsräkenskaperna\n avläsa företagets ställning. Bolagets\n eget kapital har i många år legat\npå ungefär 19 procent av hela omslutningen.\n Den övervägande delen har sålunda\n varit främmande kapital. Detta\nsakförhållande är dock ingenting man\ni dag skall känna sig överraskad av, ty\ndet har vem som helst kunnat utläsa\nur de offentliga räkenskaperna.\n"
"https://betalab.kb.se/prot-1957--ak--19#1-84-cblock_3-block_4",Text,1,"274,899,718,430","Det som är litet betänkligt i propositionen\n är en del skrivningar som tyder\n på att regeringen har anspråk på att\nuppträda som bolagsstyrelse och att\nlägga sig i detaljer i bolagets investeringar\n och följa dem på ett annat sätt\nän hittills. Men vill man ha ett bra bolag,\n så skall man sätta till en styrelse,\nsom man har förtroende för, och sedan\nskall den styrelsen få fungera.\n"
"https://betalab.kb.se/prot-1957--ak--19#1-84-cblock_3-block_5",Text,1,"272,1343,718,519","Vi vill ha Statens skogsindustrier\nkvar, och vi vill att företaget skall utvecklas.\n Men det skall inte ske hur som\nhelst. Jag håller med finansministern\nnär han säger att ett företag kan bli\nalltför expansivt. Det förtjänar emellertid\n att framhållas att det här inte är\nfråga om en expansion på skattebetalarnas\n bekostnad, som det har sagts i ett\npar debattinlägg från högerhåll, utan en\nexpansion som väl motsvaras av inkomster\n från skogsförvaltningen.\n"
"https://betalab.kb.se/prot-1957--ak--19#1-84-cblock_3-block_6",Text,1,"270,1881,717,651","Varför inte se frågan om ASSI:s investeringar\n från affärsmässiga synpunkter\n och jämföra med vad som sker inom\nprivata skogskoncernerna? Där har man\nskogsförvaltningen och skogsindustrien\nunder samma finansiella ledning, vilket\nbetyder att de pengar man tjänar på\nskogen kan sättas in i skogsindustrierna.\n Det är inte något fel att flytta över\npengar på det sättet, ty skogen har ju\ninget värde i och för sig, om det inte\nfinns någon efterfrågan på skogens produkter.\n Och denna efterfrågan skapas\nav effektiva skogsindustrier. Ju mera\neffektivt man kan bygga ut dem, desto\n"
"https://betalab.kb.se/prot-1957--ak--19#1-84-cblock_4-block_7",Text,1,"1046,322,719,430","större värde får skogen. Att finansiera\nskogsindustrierna med hjälp av vinster\nfrån skogen är därför fullt i sin ordning.\n Detta är den tanke, som finansministern\n själv har varit inne på, när\nhan förklarar, att de 35 miljoner kronor\n som nu föreslås motsvarar 70 procent\n av de 50 miljoner kronor, som domänverket\n väntas ge i netto under nästa\nbudgetår.\n"
"https://betalab.kb.se/prot-1957--ak--19#1-84-cblock_4-block_8",Text,1,"1042,771,721,1048","Låt oss ta fasta på den princip, som\nfinansministern har varit inne på, och\ntillämpa den på samma sätt som man\ngör inom det privata näringslivet. Det\nbetyder att vi skall dra upp en ekonomisk\n ram, inom vilken bolaget skall\nexpandera. Man skall inte göra den ramen\n så snäv, att man fordrar att ett\nföretag som inte har egna skogar skall\nbygga upp sin industri åt skogsbolaget\nutan ersättning från skogsförvaltningens\n sida. Men investeringarna skall inte\nses mot ett enda års nettovinst för domänverket.\n Investeringar är inte ettåriga\n utan långsiktiga företeelser. Om\nvi därför ser investeringarna mot t. ex.\nden senaste femårsperiodens resultat,\nså finner vi att domänverket till statskassan\n har inlevererat 335 miljoner kronor,\n och om finansministerns princip\nhade tillämpats i tid, hade det betytt att\n70 procent därav, d .v. s. 234 miljoner\nkronor, hade kunnat användas för utbyggnad\n av skogsindustrierna.\n"
"https://betalab.kb.se/prot-1957--ak--19#1-84-cblock_4-block_9",Text,1,"1040,1837,717,696","En sådan hopknytning av skogsförvaltningens\n och skogsindustriens ekonomi\n förekommer inom de enskilda\nskogskoncernerna, och den är intet att\nanmärka mot. Ge Statens skogsindustrier\nsamma handlingsmöjligheter, och låt\ndem arbeta på lika villkor som det enskilda\n näringslivet! — om man nu inte\när ute efter att sätta krokben för företaget.\n Låt ASSI följa denna regel om investeringar\n efter egna möjligheter plus 70\nprocent av domänverkets nettovinster!\nDet skall väl inte vara så, att staten tar\nut 335 miljoner från skogarna och låter\nbli att sätta in pengar i skogsnäringen.\nDet kallas i andra sammanhang för\n"
