id,type,tag,box,content
"https://betalab.kb.se/prot-1970--ak--21#1-39-cblock_1-block_1",Text,1,"156,323,717,352","grundläggande »beredskapsuppgift>.\nDen innebär att FN i ett spänt läge, där\nstormakterna bundit sig i motsatta\nståndpunkter, erbjuder en ram för medling\n och förhandling. Detta är av central\n betydelse i kärnvapenåldern, då en\nöppen stormaktskonflikt skulle utlösa\nen oöverskådlig katastrof.\n"
"https://betalab.kb.se/prot-1970--ak--21#1-39-cblock_1-block_2",Text,1,"157,684,716,351","FN:s fredsbevarande betydelse sträcker\n sig också utöver en sådan »beredskapsroll».\n Organisationen har utbildat\nett fredsmaskineri, som utnyttjas redan\ni dagens akuta konflikter. Inte minst\nviktigt är att FN-stadgans principer ger\nrättesnören för handlandet, som gradvis\nkan påverka staternas politik.\n"
"https://betalab.kb.se/prot-1970--ak--21#1-39-cblock_1-block_3",Text,1,"155,1048,718,977","Den snabba tekniska och samhälleliga\nutvecklingen ställer Förenta nationerna\n inför betydelsefulla uppgifter. FN:s\nolika specialorgan söker överbrygga\nden klyfta mellan rika och fattiga länder,\n som är ett resultat inte minst av\nden tekniska och ekonomiska utvecklingen.\n Internationellt samarbete har\nvisat sig nödvändigt för att undanröja\nframtida konfliktanledningar när del\ngäller utforskningen och exploateringen\nav rymden och principerna för havsbottnens\n utnyttjande samt i vad avser\nskyddet av den mänskliga miljön. På\ndessa tre områden är det av särskild\nvikt att ge utvecklingen en inriktning,\nsom är till gagn för världssamfundet.\nHär utgör Förenta nationerna ofta del\nenda forum där de mindre staterna kan\nhävda sina intressen gentemot stormakterna\n med deras dominerande tekniska\növerlägsenhet.\n"
"https://betalab.kb.se/prot-1970--ak--21#1-39-cblock_1-block_4",Text,1,"155,2040,718,520","Insikten om att FN har och i framtiden\n kan väntas få betydelsefulla uppgifter\n kan givetvis inte undanskymma del\ngrundläggande faktum, att förbindelserna\n mellan Förenta staterna och Sovjelunionen\n är av avgörande betydelse för\nfrågan om världsfredens bevarande.\nDessa båda supermakter möter problem\ni sina relationer till andra stormakter.\nInte minst gäller detta världens folkrikaste\n nation, den kinesiska folkrepubliken.\n Det är av intresse att både Förenta\n"
"https://betalab.kb.se/prot-1970--ak--21#1-39-cblock_4-block_7",Text,1,"929,320,718,669","staterna och Sovjetunionen i dag befinner\n sig i kontakt med Kina. Sovjetunionen\n och Kina för i Peking förhandlingar\n om de motsättningar dem emellan\nsom framträtt i öppen dag. Den avbrutna\n amerikansk-kinesiska dialogen har\nåterupptagits i Warszawa. Två betydande\n medlemmar av det västliga allianssystemet,\n Canada och Italien, är\ninbegripna i förhandlingar om upprättande\n av diplomatiska förbindelser med\nPeking. Utvecklingen understryker allt\nstarkare nödvändigheten av att Kina\nsnarast bereds möjlighet att inta sin\nplats i Förenta nationerna.\n"
"https://betalab.kb.se/prot-1970--ak--21#1-39-cblock_4-block_8",Text,1,"928,998,717,801","Den militära »terrorbalans> som råder\n mellan Förenta staterna och Sovjetunionen\n utgör alltjämt en viss garanti\n för världsfredens fortbestånd. Men\nsupermakternas ledare har insett att\ndetta inte räcker. Terrorbalansens nivå\nfår inte fortsätta att stiga. Tvärtom bör\nden om möjligt sänkas. De amerikansksovjetiska\n överläggningarna om begränsning\n av strategiska vapen är ett välkommet\n tecken på denna insikt. Förhandlingar\n härom inleddes i höstas i Helsingfors\n och har nyligen återupptagits\ni Wien. De båda supermakternas regeringar\n kan inte vara ovetande om styrkan\n i de förväntningar om resultat på\ndetta område som en hel värld med\nrätta anser sig kunna hysa.\n"
"https://betalab.kb.se/prot-1970--ak--21#1-39-cblock_4-block_9",Text,1,"927,1812,717,754","Båda parter förefaller nöjda med resultatet\n av de preliminära diskussionerna.\n Svårigheter förutses emellertid när\nman kommer in i de egentliga sakförhandlingarna.\n Mycket stora intressen\ninte bara för de båda omedelbart berörda\n staterna utan för hela världen står\npå spel, i synnerhet som man nu tycks\nstå inför en ny vapenteknisk utveckling\n på raketområdet. En framgång med\ndessa förhandlingar skulle innebära att\nstormakterna äntligen lyckades bryta\nkärnvapenkapprustningens rörelse uppåt.\n Sverige var bland initiativtagarna\ni FN i höstas till en resolution, i vilken\ngeneralförsamlingen vädjade till de båda\n stormakternas regeringar om att för-\n"
