id,type,tag,box,content
"https://betalab.kb.se/prot-1967--fk--28#1-55-cblock_3-block_3",Text,1,"114,266,716,1113","för investeringar. Man imponeras ofta\nav den tekniska utveckling som hittills\nhar ägt rum, men faktum är att vi bara\nstår i början av en fantastisk teknisk\nutveckling, som kommer att ta sig uttryck\n på olika sätt. Det finns företag\nsom drivs bättre i stordrift, t. ex. massaindustrin.\n Även om vi är de varmaste\nvänner av småföretagsamhet, är vi fullt\nmedvetna om att just massaindustrin\ninte lämpar sig för sådan företagsform.\nDärmed har jag inte på något sätt gjort\ngällande att små och medelstora företag\ninte har sitt fulla berättigande. De kommer\n att existera i fortsättningen också.\nEtt mindre företag behöver inte nödvändigtvis\n drivas orationellt, utan det\nkan ha en ytterligt rationell drift. Det\nfinns inom speciella områden, t.ex. i\nGnosjö, småföretagare som levererar till\nstora svenska företag utan att dessa\nstorföretag någonsin har tänkt sig att\nsjälva ta upp den tillverkningen. Ifrågavarande\n produkter tillverkas lika rationellt\n i småföretagets form.\n"
"https://betalab.kb.se/prot-1967--fk--28#1-55-cblock_3-block_4",Text,1,"114,1389,717,1156","Vi är alltså fullt medvetna om att den\nomvandling som nu sker i vårt näringsliv\n kan kräva stora kapitalinsatser. Centerpartiet\n och folkpartiet har åtskilliga\ngånger krävt en mer aktiv, konstruktiv\noch långsiktig näringspolitik än den\nsom regeringen för. Vi har lagt fram en\nrad förslag som alla syftar till att förbättra\n företagens kapitalförsörjning och\ndärmed trygga effektiviteten och sysselsättningsmöjligheterna\n på längre sikt.\nKraftfulla åtgärder har krävts för att\nfrämja produktionen, öka den totala kapitaltillgången\n och möjliggöra en bättre\nsjälvfinansiering och konsolidering inom\n företagen — dels genom att hejda\nden för konkurrensförmågan gentemot\nutlandet så förödande inflationen och\nden allmänna kostnadsfördyringen och\ndels genom en genomgripande skattereform.\n Det kan också nämnas åtgärder för\nfrämjande av sparande, större möjligheter\n för ianspråktagande av AP-fonderna\n m.m., som vid olika tillfällen\nföreslagits av centern. Men i stället för\natt föra en verkligt aktiv näringspolitik\n"
"https://betalab.kb.se/prot-1967--fk--28#1-55-cblock_4-block_5",Text,1,"886,265,712,81","på lång sikt har regeringen fortsatt\nmed sitt vanliga lappverk.\n"
"https://betalab.kb.se/prot-1967--fk--28#1-55-cblock_4-block_6",Text,1,"885,355,715,978","Investeringsbanken är ett av de medel\n som vi anser bör användas för att\ngöra det svenska näringslivet mer konkurrenskraftigt.\n Denna konkurrenskraft\n— det vill jag understryka är så\nmycket mer nödvändig som vi nu lyckligtvis\n har fått en allt friare handel i\nvärlden, i synnerhet inom det europeiska\n området. Och vi kanske förväntar\natt vi skall nå ännu längre i det avseendet.\n Den är också nödvändig för att\neffektivt kunna lösa ett av de viktigaste\nproblemen i vårt samhälle, nämligen\nden fulla sysselsättningen. Alla ansträngningar\n måste göras för att vårt\nnäringsliv skall bli så effektivt och konkurrenskraftigt\n att alla medborgare kan\nberedas sysselsättning. Av den anledningen\n är det svårt att förstå att regeringspartiet\n inte i större utsträckning\ntar hänsyn till mittenpartiernas verkligt\n positiva förslag.\n"
"https://betalab.kb.se/prot-1967--fk--28#1-55-cblock_4-block_7",Text,1,"887,1343,713,618","Jag konstaterar med tillfredsställelse\natt herr Holmberg tydligen helt slutit\nupp på centerns linje i fråga om att vi\nskall ba en ordentlig arbetslöshetsförsäkring.\n När jag i detta sammanhang\nhar talat om de konstruktiva förslagen\nfrån centern och folkpartiet, har herr\nStåhle understrukit den negativa inställning\n som herr Åkerlund och högerpartiet\n över huvud taget har till dem.\nJag förstår att herr Ståhle därmed ville\nerkänna att det verkligen är ett ordentligt\n alternativ som centern och folkpartiet\n har presenterat.\n"
"https://betalab.kb.se/prot-1967--fk--28#1-55-cblock_4-block_8",Text,1,"886,1971,714,573","Beträffande investeringsbanken bör\ndet noteras — det har visserligen gjorts\ntidigare, men när avgörandet nu nalkas\när det anledning att erinra om det igen\n— att banken inte tillför mer kapital\ntill kapitalmarknaden i år. Höjning av\nomsättningsskatten är ett led i en finanspolitisk\n förstärkning för att nå\nfram till en överbalanserad driftbudget.\n Det finns inga pengar som är öronmärkta\n på det sättet, att de medel som\nkommer från omsättningsskatten skulle\ngå speciellt till investeringsbanken. Jag\n"
