id,type,tag,box,content
"https://betalab.kb.se/prot-1926--fk--22#1-48-cblock_5-block_5",Text,1,"263,240,1504,247","dentligt om att även detta lynnesdrag finnes med i den komplex, som är det\nsvenska nationallynnet. Jag delar fullständigt den meningen, att berömmet\nifrån andra håll i världen, icke borde vara det för oss i första hand utslagsgivande.\n Sverige har, heter det nu från andra håll, utgått ur denna kris icke med\nsänkt prestige utan med ökad prestige. Det borde, menar jag, vi kunna förstå\nsjälva.\n"
"https://betalab.kb.se/prot-1926--fk--22#1-48-cblock_6-block_6",Text,1,"261,545,1504,88","Herr Hammarskjöld, Hjalmar: Vad hans excellens statsministern yttrade\nsärskilt gentemot mig föranleder endast en helt kort replik.\n"
"https://betalab.kb.se/prot-1926--fk--22#1-48-cblock_6-block_7",Text,1,"257,630,1509,418","När den svenska regeringen fattade och kungjorde sitt beslut att motsätta\nsig en utökning av rådets medlemsantal, så var det fullkomligt känt, att från\nannat håll en sådan utökning skulle komma att yrkas. Det förefaller då omöjligt\n eller åtminstone otroligt, att någon, som sysselsatt sig med denna fråga,\nicke skulle inse, att fattandet av vårt beslut skuile kunna leda till en\nkatastrof, om nämligen ifrågavarande makter icke gåve vika för det svenska\nvetot. Emellertid finner jag nu, att denna eventualitet icke tyckes\nha varit förutsedd av den svenska regeringen, när den fattade sitt beslut. Det\när en sak, som förvånar mig, ty det förefaller mig, som om konsekvensen låg\nså nära till hands, att den icke kunde förbises.\n"
"https://betalab.kb.se/prot-1926--fk--22#1-48-cblock_6-block_8",Text,1,"258,1056,1504,166","Om jag skall anses böra svara på hans excellens till mig framställda direkta\nfråga, så vill jag göra det på det sättet, att jag icke skulle ha fattat ett sådant\nbeslut som det, vilket meddelades första kammaren den 5 mars i år, utan att\nförut ha gjort mig reda för konsekvenserna.\n"
"https://betalab.kb.se/prot-1926--fk--22#1-48-cblock_7-block_9",Text,1,"259,1292,1508,82","Herr Ljunglund: Herr talman! Jag skall be att få svara med några ord på\nhans excellens herr statsministerns replik.\n"
"https://betalab.kb.se/prot-1926--fk--22#1-48-cblock_7-block_10",Text,1,"258,1376,1508,1134","Det förefaller mig, som om hans excellens statsministern i någon mån överskattade\n — och att detta är just det grundläggande felet — Sveriges uppgift\nvid detta extra möte i Nationernas förbund. Denna överskattning erinrar mig\nlitet om vad Livius berättar om de delegater, som år 218 skickades till Kartago\noch som voro livligt övertygade om, att de buro världsfreden eller världskriget\n1 vecken av sina togor. Det förhöll sig verkligen icke så, då Sverige gick ut\npå denna högtidliga expedition. Saken var nämligen den, att Tysklands inträde\n i Nationernas förbund var beslutat mellan stormakterna vid sammanträdet\n i Locarno, och löften därom voro utväxlade. Mötet i Geneve hölls alls\ninte för att arbeta för Tysklands inträde, som hans excellens statsministern\nsynes tro, utan endast för att fastställa formerna för inträdet. Dessutom fanns\ndet en del makter, som begagnade detta inträde för att smuggla in i Nationernas\n förbunds konstitution element, som voro mycket farliga, i det de voro ägnade\n att spränga konstitutionen. Det var detta, som man verkligen också hade\nförutsett och som hans excellens utrikesministern säkerligen också förutsett,\ndå han talade här till oss den 5 mars, och härutinnan sade vi, att vi ville stå\npå hans sida med den pondus, som denna kammare kan ha, och hans excellens\nherr utrikesministern visste med sig, att han hade hela landet bakom sig i detta\navseende. Överskattningen av Sveriges uppgift måste emellertid i all stillhet\näven ha funnits hos hans excellens herr utrikesministern, fastän han, som det\nföreföll mig den 5 mars, såg sunt och klart på saken den gången, ty han fick\n1 Geneve den föreställningen, att Sverige borde gripa in, när han såg det trassla\ntill sig, när han såg, att Englands och Frankrikes representanter blevo försatta\n1 upprörd stämning över, att Sverige gjorde motstånd. Men detta Sveriges\nmotstånd var hans uppgift att verkligen sköta. Hade han haft klart för sig,\natt även om dessa herrar Briand och Chamberlain, stormäktiga och betydelsefulla\n män, blevo aldrig så förbittrade, så var det dock hans uppgift att stå fast\n"
