id,type,tag,box,content
"https://betalab.kb.se/prot-1924--ak--3#1-3-cblock_1-block_1",Text,1,"117,254,1507,376","tid han satt vid styret gå, utan något steg togs för att återupptaga förhandlingarna\n angående det ryska handelsavtalet, fastän tecknen redan då rätt tydligt\nvisade, att vi kanske hade åtskilligt att vinna, men också ganska säkert mycket\natt riskera på att denna fråga icke bragtes närmare sin lösning. Målsmännen för\nvåra näringar blevo mera angelägna att få en uppgörelse till stånd än vad de\nförut hade varit; och den uppgörelse, som fälldes av eniga borgerliga partier\når 1922, var ju dock fälld under sådana förutsättningar och villkor, att man\nicke därmed skulle avklippa alla möjligheter till en uppgörelse, utan tvärtom\nförnya försöken att komma till vad man ansåg vara en bättre överenskommelse.\n"
"https://betalab.kb.se/prot-1924--ak--3#1-3-cblock_1-block_2",Text,1,"117,628,1507,207","Sedan nuvarande utrikesministern till landets fromma ställt sig till förfogande\n för att söka utplåna följderna utav olyckliga uttalanden från sin företrädares\n sida, äro ju förhandlingar i gång, och alla önska vi helt visst, att\ntrontalets förhoppning om ett gott resultat av desamma måtte snarast möjligt\ngå 1 fullbordan.\n"
"https://betalab.kb.se/prot-1924--ak--3#1-3-cblock_1-block_3",Text,1,"114,839,1509,462","Den beslutsamhet, varmed utrikesministerskiftet ägde rum, måste väl få\nfattas så, att även här har det varit fråga om att »lära om», att verkligen göra\nen sinnesändring, så att hädanefter regeringens allvarliga strävan måste gå ut\npå att åstadkomma ett gott och naturligt förhållande till det stora ryska riket,\nsom för vår blivande avsättning har en så i ögonen fallande betydelse — liksom\n självfallet också ett gott förhållande till Finland och till de små nya staterna\n söder om Finska viken. Att det är hög tid på att åstadkomma en sådan\nuppgörelse, skall jag icke alls nu gå in närmare på. Jag skall blott erinra\nom att i England pågår i detta ögonblick en adressdebatt, som väntas komma\natt leda till konsekvenser, vilka kanske även för oss i detta avseende kunna\nvara betydelsefulla.\n"
"https://betalab.kb.se/prot-1924--ak--3#1-3-cblock_1-block_4",Text,1,"110,1304,1508,330","Den stora huvudfrågan vid detta årets riksdag är ju emellertid försvarsfrågan,\n och som saken ligger skall jag, såsom förut nämnts, i dag icke mycket\norda därom. TI trontalet finnes det vissa uttalanden av allmänt innehåll, formade\n uti allmänna satser, som kunna betyda bra och som kunna betyda mindre\n bra. Det kan i dem inrymmas både för mycket och för tungt av bördor,\noch det kan också inrymmas ett mindre i den vägen. I en snar framtid koma\n vi att veta mera om vad som i verkligheten ligger bakom sådana uttalanden.\n\n"
"https://betalab.kb.se/prot-1924--ak--3#1-3-cblock_1-block_5",Text,1,"108,1643,1506,214","I avvaktan härpå har emellertid statsministern uti ett mycket utförligt uttalande\n i Uppsala givit en bakgrund, en så att säga andlig bakgrund, ifrån\nvilken han betraktar vår försvarsfråga, och detta gör, att jag tror det är lämpligt\n att i dag med några ord i detta sammanhang belysa, huruvida man kan\nvara med på den bakgrundsmålningen eller ej.\n"
"https://betalab.kb.se/prot-1924--ak--3#1-3-cblock_1-block_6",Text,1,"105,1854,1506,559","Genast jag läste detta anförande blev jag för min del slagen utav den djupa\npessimism, som var grundtonen uti detsamma. Det är mörkt, mörkare och\nmörkast uti målningen hela vägen. Jag förstår ganska väl, att sammanstörtandet\n utav så mycket, som varit genom långa tider kärt, präglar ett sinne till\nen viss pessimistisk syn; men den beslutsamhet, som på så många håll samtidigt\n framträder, att dock göra det bästa av den nya tidsålder, som man kommit\n in uti — låt vara att denna tidsålder är mycket främmande i många avseenden\n för ens allmänna grundåskådning å den sidan — den borde dock kunna\nlyfta till riktigare och rättvisare omdömen, än vad som här synes mig vara fallet.\n Det kan icke nekas till, att detta uppsalatal blivit ett ledsamt preludium\ntill den blivande försvarsriksdagen. Skall verkligen ännu en gång, såsom\nskedde år 1913 och 1914, vårt folk skrämmas till att på grund av dylika målningar\n taga på sig mera av försvarsbördor, än som finnes verkligt fog för?\n"
"https://betalab.kb.se/prot-1924--ak--3#1-3-cblock_1-block_7",Text,1,"104,2407,1505,134","Uppsalatalet har en mycket stor förtjänst i, att där klart betonas freds- och\nneutralitetsviljan såsom riktlinje för vår politik, och det avvisar bestämt och\nutan tvetydighet alla alliansfunderingar, som kunna vara riktade mot någon\n"
