id,type,tag,box,content
"https://betalab.kb.se/prot-1947--fk--26#1-15-cblock_1-block_2",Text,1,"113,323,1504,39","det reala värdet av de absoluta öretalen är någonting annat nu än vad det var\n"
"https://betalab.kb.se/prot-1947--fk--26#1-15-cblock_1-block_3",Text,1,"110,365,1506,41","tidigare, får man klar för sig bilden av själva utvecklingen, en bild som visar,\n"
"https://betalab.kb.se/prot-1947--fk--26#1-15-cblock_1-block_4",Text,1,"112,408,949,40","att den nuvarande klyftan håller på att minskas.\n"
"https://betalab.kb.se/prot-1947--fk--26#1-15-cblock_1-block_5",Text,1,"110,449,1509,373","Sedan är ju att märka — och det framgick indirekt av herr von Helands\nanförande, men kanske inte så tydligt, som skulle ha varit önskvärt — att\nockså de 5 procent, som ramavtalet gav i tillägg från den 1 maj, ha tillgodoräknats\n jordbrukarna och lantarbetarna. Dessa 5 procent ge för industriarbetarna\n inte något medeltal av 7\"/; öre, som herr von Heland uttryckte det, utan\nge ett betydligt blygsammare belopp. Även om man beaktar denna justering\n enligt ramavtalet och även om man räknar i absoluta ören, blir den av\nregeringen föreslagna regleringen väl jämförbar med vad industriarbetarna i\nmedeltal ha fått.\n"
"https://betalab.kb.se/prot-1947--fk--26#1-15-cblock_1-block_6",Text,1,"109,830,1509,463","Jag vill säga till herr Domö, att det naturligtvis är mycket lätt att stå i\nriksdagen och uttala, att regeringen borde ha träffat uppgörelsen snabbare och\ntidigare. Skulle det innebära, att herr Domö indirekt gör sig till tolk för den\nuppfattningen, att om det bara blivit ett snabbt beslut, skulle jordbrukarna\nha varit beredda att ta en uppgörelse, som legat betydligt närmare regeringens\nbud än vad de nu kräva. Då hade det för all del funnits ett skäl att skynda\npå förhandlingarna. Hade jordbrukarna varit mera benägna att svälja en lägre\nsumma för en månad sedan, kan man självfallet beklaga, att inte uppgörelsen\nträffades för en månad sedan. Men herr Domö är inte så främmande för praktiskt\n förhandlingsarbete som hans anförande kan tyda på. Han vet mycket\nväl, att om det skall bli en uppgörelse, måste det finnas förutsättningar härför.\n"
"https://betalab.kb.se/prot-1947--fk--26#1-15-cblock_1-block_7",Text,1,"106,1295,1512,842","Såsom den inom regeringen, som närmast hade hand om sockerbetsförhandlingarna,\n hade jag kunnat träffa ett avtal redan första gången, om jag hade\ngått med på 5 kronor 20 öre. Det ansågs vara för mycket, och den slutliga uppgörelsen\n stannade vid 5 kronor. Jag hade självfallet såsom ledamot av den\nförhandlingskommitté, som inom regeringen svarar för de stora förhandlingarna\n om jordbrukspriserna, kunnat räkna med en uppgörelse redan första\nförhandlingstillfället, om vi hade förklarat oss beredda att godtaga en summa\nav 230 miljoner kronor. Men skall det vara något tecken på avancerad förhandlingsförmåga,\n att den ena parten bara accepterar vad den andra parten\npresenterar, då måste jag ju erkänna, att de år jag har bakom mig som förhandlare\n sannerligen inte ha givit sådana resultat som enligt herr Domös uppfattning\n äro signifikativa för en god förhandlare. Man måste ju ändå konstatera,\n att det är två parter som sitta i olika positioner och ha olika intressen.\nMan förhandlar och drar, och man försöker komma till uppgörelse. Man ger\ninte upp hoppet första gången, utan man gör ett nytt försök. Man ger inte upp\nhoppet vare sig andra eller tredje gången, utan man försöker en fjärde gång.\nNär emellertid inte heller det lyckas, får man konstatera, att det tråkigt nog\ninte är möjligt att komma fram förhandlingsvägen. Men jag måste bestämt\nsäga, att det inte har någonting med vederbörandes förhandlarkvalifikationer\natt göra, om det råkar bli på detta sätt.\n"
"https://betalab.kb.se/prot-1947--fk--26#1-15-cblock_2-block_8",Text,1,"109,2182,1507,331","Herr Elofsson, Gustaf: Herr talman! Då jag hörde statsrådet Sträng redogöra\n för underhandlingarna vid uppgörelsen om sockerbetorna, kunde jag inte\nunderlåta att begära ordet. När en regering drar ut på förhandlingarna så som\nskedde den gången man kunde på flera platser inte så betorna förrän fjorton\ndagar senare än som eljest hade varit möjligt — kan man väl ändå inte säga,\natt det är tillfredsställande. I ett tal, som jag har läst i tidningarna, har statsrådet\n Sträng framhållit, att jordbruket har gudi väl fått tillräckligt — det\nvar innan regeringens bud vid förhandlingarna höjdes sista gången. Då skulle\n"
