id,type,tag,box,content
"https://betalab.kb.se/prot-1922--fk--27#1-23-cblock_1-block_1",Text,1,"146,262,1554,351","Han har icke bestritt att, om lagen nu antages, och det visade sig, Ang. utvidgad\natt de nuvarande anstalterna icke vore tillräckliga, utan nya sådana be- ov BT\nhövde byggas, en kungl. proposition om en ny anstalt skulle bliva följ- behandling av\nden av lagens antagande. En sådan proposition kan riksdagen ej under- alkoholister.\nlåta att bifalla, om den föreliggande lagen antages. Det är just den <(Forts.)\nsaken, som gör, att jag för min del har anfört reservation. Jag anser\nför min del alldeles uteslutet, att under de närmaste åren någon ny byggnad\n för ändamålet kan komma i fråga, och därför, herr talman, vidhåller\n"
"https://betalab.kb.se/prot-1922--fk--27#1-23-cblock_2-block_2",Text,1,"145,617,328,39","jag mitt yrkande.\n"
"https://betalab.kb.se/prot-1922--fk--27#1-23-cblock_3-block_3",Text,1,"137,688,1338,576","Herr Petrén, Alfred: Endast ett par ord. Greve Spens\nnämnde i sitt första anförande, att tillgången på platser för tvångsinternering\n av alkoholister var otillräcklig. Så är icke förhållandet. Alla\ntill statens alkoholistanstalt anmälda hava, sedan återflyttningen till\nVenngarn ägt rum, omedelbart kunnat mottagas. Högsta beläggningssiffran\n på Venngarn har varit 104, vilket är föga över den normala beläggningen.\n Men anstalten kan betydligt överbeläggas, och under denna\nmånad har det för övrigt visat sig en nedgång; antalet har nämligen\nminskats med fem sedan den 1 april, och nu kommer en tid, då utskrivningarna\n bli talrikare, ty utskrivningar äga framför allt rum under de\nårstider, då det är lättare att anskaffa arbete. Vidare är det så, att en\nav de erkända anstalterna, den vid Lerjeholm, icke är mer än till hälften\nbelagd.\n"
"https://betalab.kb.se/prot-1922--fk--27#1-23-cblock_3-block_4",Text,1,"137,1269,1336,801","Huruvida på grund av lagens utvidgning — den bästa tidpunkten\nför dess promulgerande lägges ju i Kungl. Maj:ts hand att bedöma —\ndet kan behövas några nya anstalter, beror, såsom redan framhållits av\nutskottets ordförande, helt och hållet på huruvida det på annat sätt kan\nordnas för dem, vilka upprepade gånger hava recidiverat och därför\npraktiskt kunna betraktas såsom oförbätterliga. På grund av lagens\npreventiva verkan, som, ju längre den får verka, kommer att allt mera\ngöra sig gällande, blir med åren antalet oförbätterliga proportionsvis\nstörre bland de intagna, och i den mån det på annat sätt ordnas för dessa,\nkomma platserna på statens alkoholistanstalter att bättre räcka till. I\ndet hänseendet har utskottet uti sitt andra betänkande, frånsett att utskottet\n tillstyrkt överflyttning av alkoholister till Svartsjö i större utsträckning\n än hittills varit tillåtet, också pekat på möjligheten av att i\nframtiden lösa frågan om de oförbätterliga alkoholisternas omhändertagande\n i samband med de arbetshem, som skola inrättas jämlikt fattigvårdslagens\n 33 $. Under sådana förhållanden, och då det är lagt i\nKungl. Maj:ts hand att besluta om tidpunkten för lagens trädande i\nkraft, hemställer jag om bifall till utskottets hemställan.\n"
"https://betalab.kb.se/prot-1922--fk--27#1-23-cblock_4-block_5",Text,1,"135,2090,1333,222","Efter det överläggningen förklarats härmed slutad, gjordes enligt\nföreliggande yrkanden propositioner, först på bifall till samt vidare på\navslag å vad utskottet i det under behandling varande utlåtandet hemställt;\n och förklarades den förra propositionen, vilken upprepades, vara\nmed övervägande ja besvarad.\n"
