id,type,tag,box,content
"https://betalab.kb.se/prot-1962--ak--11#1-6-cblock_13-block_15",Text,1,"235,2424,715,83","som yttrade:\nHerr talman! Jag tillåter mig hem-\n"
"https://betalab.kb.se/prot-1962--ak--11#1-6-cblock_14-block_16",Text,1,"1011,296,717,428","ställa att kammaren ville besluta, att\ntiden för avgivande av motioner i anledning\n av Kungl. Maj:ts propositioner\n nr 54 och 61 måtte med hänsyn\ntill ärendenas omfattning utsträckas\ntill det sammanträde, som infaller näst\nefter femton dagar från det propositionerna\n kom kammaren till handa,\nd. v. s. första plenum efter torsdagen\nden 22 innevarande mars.\n"
"https://betalab.kb.se/prot-1962--ak--11#1-6-cblock_20-block_23",Text,1,"1006,1190,718,125","Herr talman! Alltsedan årsskiftet\nhar tidningarna — i likhet med föregående\n år — nära nog varje vecka haft\n"
"https://betalab.kb.se/prot-1962--ak--11#1-6-cblock_21-block_24",Text,1,"1006,1322,717,162","skildringar om oljeskadade fåglar som\ndrunknat, hungrat eller frusit ihjäl såvitt\ninte fåglarnas lidanden förkortats genom\n välriktade skott.\n"
"https://betalab.kb.se/prot-1962--ak--11#1-6-cblock_21-block_25",Text,1,"1004,1499,718,567","Från hallandskusten rapporteras att\ncirka 4 000 sjöfåglar hittats döda eller\nsvårt oljeskadade på sträckan Varberg—\nHaverdal norr om Halmstad. På den lilla\ndanska ön Anholt mellan Grenå och\nVarberg har 2000 sjöfåglar hittats på\nden 6 km långa strandremsan. Oljedöden\n torde vara en av de värsta som någonsin\n drabbat västkusten. Liknande\nrapporter kommer från skånekusten där\nen enda patrull en dag sköt 150 fåglar:\nsvärtor, alfåglar, sjöorrar, knipor och\ntobisgrisslor.\n"
"https://betalab.kb.se/prot-1962--ak--11#1-6-cblock_21-block_26",Text,1,"1003,2074,717,430","Värst synes läget i år vara på Gotland,\n där denna vinter blivit den hittills\nolyckligaste för alfåglarna i Östersjön,\nen vinter då hela frågan om den svenska\n alfågelstammens fortbestånd tillspetsats\n till det yttersta. 1952 rapporterades\n cirka 30 000 oljedödade sjöfåglar\nlängs den gotländska östkusten, 1957\n10 000—15 000 och i slutet av januari i\når över 8000 trots stammens decime-\n"
