id,type,tag,box,content
"https://betalab.kb.se/prot-1955--fk--18#1-41-cblock_3-block_3",Text,1,"105,297,733,74","anvisade för detta ändamål. Det är det\nhela.\n"
"https://betalab.kb.se/prot-1955--fk--18#1-41-cblock_3-block_4",Text,1,"104,382,737,544","Statsrådet synes emellertid mest benägen\n att slå bort särskilda utskottets\nbetänkande 1950, på vilket kompromissen\n i detta hus byggdes. Han talar med\nen underton av ringaktning om »1950\nårs urkunder», och när departementschefen\n citerar, väljer han sina citat med\nförkärlek ur andra källor än utskottsskrivningen.\n Min blygsamma uppgift här\nhar synts mig böra bestå däri, att jag\nerinrar en så strängt upptagen man som\ndepartementschefen om den rätta vägen.\n\n"
"https://betalab.kb.se/prot-1955--fk--18#1-41-cblock_3-block_5",Text,1,"107,929,737,881","Statsrådet hävdar vidare, att jämförelserna\n mellan de olika elevgrupperna\ninom den gamla och den nya skolan är\nsvåra att arrangera. Det är de, det finns\ningen tvekan om den saken. Men vad\nligger det då för fel i att jag här påfordrar,\n att landets för dylika uppgifter\n mest kapabla krafter sätts in för att\nlösa sådana problem? Det är återigen\ninte alls fråga om huruvida jag därvidlag\n finner, att det inte föreligger några\nsvårigheter — jag har för resten inte\nalls direkt uttalat mig om den saken —\nutan det är fråga om huruvida vi i landet\n i övrigt har tillgång till folk med\nförmåga att lösa dylika problem, och\ndet har vi. Varför får inte dessa experter\n »parallellt med de praktiska försöken»\n göra sina »vetenskapliga undersökningar»,\n så som riksdagen på sin tid\navsåg?\n"
"https://betalab.kb.se/prot-1955--fk--18#1-41-cblock_3-block_6",Text,1,"113,1815,735,614","Statsrådet söker också misstänkliggöra\n vetenskapens objektivitet. Han säger,\natt den i liknande sammanhang tidigare\n visat sig vara ett »sken». Men tror\ninte statsrådet i alla fall, att det kan\nför sakens skull vara av rätt stort värde\natt som ett blygsamt bidrag få ta emot\nvad folk, som dock under hela sin utbildning\n tränats till just objektivitet,\nkan ha att säga om det hela och om dess\ndetaljer? Den extremt subjektiva verksamhet\n som kallas politik har god nytta\nav dylika injektioner, och vi brukar i\nallmänhet i detta hus inte frånkänna\ndem ett värde.\n"
"https://betalab.kb.se/prot-1955--fk--18#1-41-cblock_3-block_7",Text,1,"121,2442,727,76","Statsrådets polemiska talang -— som\nhär och var blommar på ett mycket\n"
"https://betalab.kb.se/prot-1955--fk--18#1-41-cblock_4-block_8",Text,1,"877,297,735,794","praktfullt sätt i interpellationssvaret —\ngår också igen, då han höjer sina ögonbryn\n inför mitt påpekande, att man vid\nförsöken kan göra »lärarfaktorn likvärdig\n eller, om man så hellre vill, för jämförelsens\n skull, olikvärdig». »Vad kan\nman mena med det?» frågar statsrådet\nförbryllad. Jo, med ett sådant försök\nskulle man kunna få klarlagt, vilken roll\nen lärares utbildning spelar. är det verkligen\n så, att det blir bättre kunskapsresultat\n med bättre utbildade lärare? Ligger\n med andra ord orsaken till de onekligen\n dåliga resultaten i enhetsskoleklasserna\n däri, att man inte har akademiskt\nutbildade lärare i katedrarna, eller kan\ndet tänkas andra anledningar, t. ex. på\nmetodikens område eller bristande arbetsdisciplin\n eller någonting annat?\n"
"https://betalab.kb.se/prot-1955--fk--18#1-41-cblock_4-block_9",Text,1,"880,1096,735,707","Statsrådet påstår vidare, att jag i min\ninterpellation förklarat mig anse, att\n»realskolan åtminstone under enhetsskolans\n försökstid borde få vara sådan den\när för att kunna tjäna såsom något slags\nrikslikare för denna nya skolform». Detta\n påstående är i sanning märkligt. I\nbörjan av min interpellation har jag\ntvärtom erinrat om att särskilda utskottet\n 1950 avsåg, att »försök även böra anställas\n inom de nu existerande skolformerna,\n avseende icke blott dessa skolformers\n utveckling under övergångstiden\noch, i vissa fall, deras anknytning till\nenhetsskolan, utan även frågor av allmän\n betydelse för skolans och den särskilda\n skolformens uppgifter.»\n"
"https://betalab.kb.se/prot-1955--fk--18#1-41-cblock_4-block_10",Text,1,"884,1807,732,285","Statsrådets reflexioner gör under sådana\n omständigheter ett oroande intryck\n och ger dessutom den föreställningen,\n att man i dag inte heller drar sig\nför de billiga effekterna, om man inte\nkan hitta på något annat i departementet.\n\n"
"https://betalab.kb.se/prot-1955--fk--18#1-41-cblock_4-block_11",Text,1,"885,2102,732,413","Jag har vidare talat om riskerna för\nett återvändande »kompletteringsraseri».\nDepartementschefen svarar, att detta har\nman under övergångstiden räknat med.\nMen vore icke här den verkligt ceffektiva\n metoden den att på allvar möda siz\nom att förbättra högstadiets kursplaner,\nvilket man ända tills i dag underlåtit?\nOm dessa har vi i den senaste redogörelsen\n i dag fått det meddelandet, att man\n"
