id,type,tag,box,content
"https://betalab.kb.se/prot-1920--ak--30#1-30-cblock_2-block_2",Text,1,"136,232,1497,42","Ang. vissa mig så mycket jord, utan skött den lilla jordbit jag har, så gott jag\n"
"https://betalab.kb.se/prot-1920--ak--30#1-30-cblock_5-block_5",Text,1,"323,275,1311,370","Om herr Månsson verkligen har intresse av att, som han\npåstår, landets jordbrukarestam uppehålles, så måste han tänka på, att\nicke den näringen får behandlas som en blindtarm till Sveriges övriga\nräringar. Vi jordbrukare begära, åtminstone gör jag det, att få bli\nlika berättigade och lika behandlade som andra medborgare och ingenting\n annat, och så länge jag har den åsikten, kan jag protestera och\nöppet se var och en i ansiktet, som vill påstå, att jag för mig själv\noch för den sambhällsgrupp, Jag tillhör, vill skaffa mig oberättigade\nfördelar på andras bekostnad.\n"
"https://betalab.kb.se/prot-1920--ak--30#1-30-cblock_6-block_6",Text,1,"322,691,1310,372","Herr Lindman: Herr talman! Jag skulle vilja begagna willfället\n att tacka herr Månsson för den komplimang, som han riktade\ntill mig och som jag för egen del skulle kunna returnera till honom.\nJag vill säga, liksom jag tror mången i denna kammare, att man i herr\nMånsson alltid finner en man, som söker sanningen. Det är emellertid\n klart, att man under sitt sanningssökande understundom kan komma\n på sned, och det kan väl hända oss litet var. Säkert vill inte heller\nherr Månsson säga, att icke även han kan råka ut för att, som man\nsäger, hugga 1 sten någon gång.\n"
"https://betalab.kb.se/prot-1920--ak--30#1-30-cblock_6-block_7",Text,1,"322,1067,1308,744","Följer man hans resonemang här, då han ordar om exportindustrier,\n småbrukare, hantverkare och storbönder, så låter det mycket\nnaturligt, att om man producerar spannmål till högre pris genom att\nman har tullskydd, så kostar det mera, levnadskostnaderna stiga och\nsåledes också exportvarorna, varmed betalningen skall ske. För närvarande\n ha vi spannmål i Sverige, men om vi icke hade tillräckligt\nmed sådan här, så skulle saken te sig annorlunda. Herr Månsson vet,\natt råg och vete betalas av staten med 39 respektive 41 kronor per\nhundra kilogram. Alltså köpa vi upp de svenska jordbrukarnas säd\ntill det priset. Samtidigt säger bevillningsutskottets ordförande, att\ndet argentinska vetet kostar här i Sverige 60 kronor. Då tillåter jag\nmig fråga herr Månsson: Är det icke bättre, att vi ha säd i Sverige\ntill 41 kronor, än att vi måste importera från Angentina och betala\n60 kronor? Genom att man har det ordnat på detta sätt bli ju framställningskostnaderna\n på alla dessa produkter billigare än eljest. Att\nvi ha det på detta sätt, beror på att man under kristiden och tidigare\ngenom tullskydd och andra åtgärder sökt driva upp brödsädesproduktionen\n i detta land.\n"
"https://betalab.kb.se/prot-1920--ak--30#1-30-cblock_6-block_8",Text,1,"324,1818,1307,455","Antag nu, att man, som herr Månsson synes vilja göra, lämnar\nde s. k. större jordbruken vind för våg och icke bryr sig om att taga\nhand om dem som förut! Jag vill då först fästa uppmärksamheten\npå, att det är de större jordbruken. som det nu gäller, ty den verklige\n småbrukaren äter upp den säd, som han producerar i sitt eget\nhushåll, varför alltså det. som skall reserveras, för arbetarna och den\növriga icke sädesproducerande befolkningen måste komma från jordbrukare,\n som ha något överskott att lämna. «Låt oss alltså antaga. att\nbönderna icke få det skydd som de anse vara rättmätigt och vilket\nvore en ersättning för det underskott, som kan uppkomma genom lägre\npriser på den utländska marknaden, hur går det då? Då blir natur-\n"
